,dayPost,timePost,codeAd,nameBike,valueBike,city,neighborhood,cep,urlBike
2499,16/02,11:31,1142085055,Bike single tam. 56. Sunburst ,1700.0,São Paulo,Vila Clementino,04037000,https://sp.olx.com.br/sao-paulo-e-regiao/ciclismo/bike-single-tam-56-sunburst-1142085055
2500,16/02,11:09,1147907052,Bicicleta Retrô Nathor,1890.0,Santo André,Centro,09010000,https://sp.olx.com.br/sao-paulo-e-regiao/ciclismo/bicicleta-retro-nathor-1147907052
2501,16/02,09:31,1147279668,Bike Fixa RAF ,1500.0,São Paulo,Vila Butantã,05360030,https://sp.olx.com.br/sao-paulo-e-regiao/ciclismo/bike-fixa-raf-1147279668
2502,16/02,09:02,1147282401,Bike fixa,2500.0,Taubaté,Chácara Santa Luzia,12091420,https://sp.olx.com.br/vale-do-paraiba-e-litoral-norte/ciclismo/bike-fixa-1147282401
2503,15/02,19:26,854820762,Bike/Venzo aro 29 kit Alívio sem um Risco,3200.0,Santo André,Centro,09020031,https://sp.olx.com.br/sao-paulo-e-regiao/ciclismo/bike-venzo-aro-29-kit-alivio-sem-um-risco-854820762
2504,,,,,,,,,
2505,15/02,14:17,1147561213,Kit freio ferradura dianteiro tektro bike fixa Specialized ,100.0,São Paulo,Santana,02035011,https://sp.olx.com.br/sao-paulo-e-regiao/ciclismo/kit-freio-ferradura-dianteiro-tektro-bike-fixa-specialized-1147561213
2506,15/02,13:40,1147544572,"rolo fixo de treino ciclismo - serve p speed 700cc / mtb 26, 27.5, 29",0.0,Mogi das Cruzes,Mogi Moderno,08717435,https://sp.olx.com.br/sao-paulo-e-regiao/ciclismo/rolo-fixo-de-treino-ciclismo-serve-p-speed-700cc-mtb-26-27-5-29-1147544572
2507,15/02,13:25,1147539637,Lanterna Traseira Bike Sinalizador Bicicleta Farol Led Luz Segurança Super Potente,39.0,São José dos Campos,Conjunto Residencial Trinta e Um de Março,12237010,https://sp.olx.com.br/vale-do-paraiba-e-litoral-norte/ciclismo/lanterna-traseira-bike-sinalizador-bicicleta-farol-led-luz-seguranca-super-potente-1147539637
2508,15/02,11:01,1127138793,Lanterna De Cabeça E Farol Bike + Alerta Traseiro B-max,130.0,Sertãozinho,Jardim Recreio,14170370,https://sp.olx.com.br/regiao-de-ribeirao-preto/ciclismo/lanterna-de-cabeca-e-farol-bike-alerta-traseiro-b-max-1127138793
2509,14/02,16:23,1030404483,Rodinha Lateral para Bicicleta Infantil Aro 16 Roda de Equilíbrio 8652,21.0,São José dos Campos,Centro,12245680,https://sp.olx.com.br/vale-do-paraiba-e-litoral-norte/ciclismo/rodinha-lateral-para-bicicleta-infantil-aro-16-roda-de-equilibrio-8652-1030404483
2510,14/02,15:40,1147153668,Peças para bicicleta speed single fixa,15.0,São Paulo,Vila União (Zona Leste),03683000,https://sp.olx.com.br/sao-paulo-e-regiao/ciclismo/pecas-para-bicicleta-speed-single-fixa-1147153668
2511,14/02,15:34,1147151830,Bicicleta mtb carbono Kestrel 1989,1998.0,São Paulo,Vila União (Zona Leste),03683000,https://sp.olx.com.br/sao-paulo-e-regiao/ciclismo/bicicleta-mtb-carbono-kestrel-1989-1147151830
2512,14/02,15:25,1147148981,Peças para bicicleta mtb ,15.0,São Paulo,Vila União (Zona Leste),03683000,https://sp.olx.com.br/sao-paulo-e-regiao/ciclismo/pecas-para-bicicleta-mtb-1147148981
2513,14/02,15:05,912081167,Suporte Avançado de Bike para GPS Garmin Edge Bryton Cateye e Câmera GoPro 7157,45.0,São José dos Campos,Centro,12245680,https://sp.olx.com.br/vale-do-paraiba-e-litoral-norte/ciclismo/suporte-avancado-de-bike-para-gps-garmin-edge-bryton-cateye-e-camera-gopro-7157-912081167
2514,14/02,15:05,937280899,Sinalizador com Led Jws WS-211 Recarregável USB 8 Leds Pisca Vermelho 5 Super Forte 7129,26.0,São José dos Campos,Centro,12245680,https://sp.olx.com.br/vale-do-paraiba-e-litoral-norte/ciclismo/sinalizador-com-led-jws-ws-211-recarregavel-usb-8-leds-pisca-vermelho-5-super-forte-7129-937280899
2515,14/02,14:44,1030409572,Pedal de encaixe Clip Bicicleta Mountain-Bike Shimano M520 Preto Com Taquinhos Sh-51 1277,405.0,São José dos Campos,Vila Ester,12221680,https://sp.olx.com.br/vale-do-paraiba-e-litoral-norte/ciclismo/pedal-de-encaixe-clip-bicicleta-mountain-bike-shimano-m520-preto-com-taquinhos-sh-51-1277-1030409572
2516,14/02,14:44,1028488988,Passador Shimano Deore XT M780 I-Spec 2 e 3x10 velocidades - Usado 8862,396.0,São José dos Campos,Centro,12245680,https://sp.olx.com.br/vale-do-paraiba-e-litoral-norte/ciclismo/passador-shimano-deore-xt-m780-i-spec-2-e-3x10-velocidades-usado-8862-1028488988
2517,14/02,14:44,935767055,Sinalizador Diant e Tras Epic Line EPL-2215 Bike Luz Noturna 2 Leds Branco e Vermelho 7509,17.0,São José dos Campos,Centro,12245680,https://sp.olx.com.br/vale-do-paraiba-e-litoral-norte/ciclismo/sinalizador-diant-e-tras-epic-line-epl-2215-bike-luz-noturna-2-leds-branco-e-vermelho-7509-935767055
2518,14/02,14:44,938812027,Chave Ferramenta JWS Extrator de Movimento Central Hollowtech e Chave de Cassete 7633,23.0,São José dos Campos,Centro,12245680,https://sp.olx.com.br/vale-do-paraiba-e-litoral-norte/ciclismo/chave-ferramenta-jws-extrator-de-movimento-central-hollowtech-e-chave-de-cassete-7633-938812027
2519,14/02,14:32,1048088672,Prolongador de Válvula Presta para Câmara de Ar Bicicleta Road 70mm 8835,35.0,São José dos Campos,Centro,12245680,https://sp.olx.com.br/vale-do-paraiba-e-litoral-norte/ciclismo/prolongador-de-valvula-presta-para-camara-de-ar-bicicleta-road-70mm-8835-1048088672
2520,15/02,13:40,1147544572,"rolo fixo de treino ciclismo - serve p speed 700cc / mtb 26, 27.5, 29",0.0,Mogi das Cruzes,Mogi Moderno,08717435,https://sp.olx.com.br/sao-paulo-e-regiao/ciclismo/rolo-fixo-de-treino-ciclismo-serve-p-speed-700cc-mtb-26-27-5-29-1147544572
2521,15/02,13:25,1147539637,Lanterna Traseira Bike Sinalizador Bicicleta Farol Led Luz Segurança Super Potente,39.0,São José dos Campos,Conjunto Residencial Trinta e Um de Março,12237010,https://sp.olx.com.br/vale-do-paraiba-e-litoral-norte/ciclismo/lanterna-traseira-bike-sinalizador-bicicleta-farol-led-luz-seguranca-super-potente-1147539637
2522,,,,,,,,,
2523,15/02,11:01,1127138793,Lanterna De Cabeça E Farol Bike + Alerta Traseiro B-max,130.0,Sertãozinho,Jardim Recreio,14170370,https://sp.olx.com.br/regiao-de-ribeirao-preto/ciclismo/lanterna-de-cabeca-e-farol-bike-alerta-traseiro-b-max-1127138793
2524,14/02,18:54,1147238086,Bicicleta Single Speed aro 700 tamanho 54,799.0,São Caetano do Sul,Boa Vista,09572100,https://sp.olx.com.br/sao-paulo-e-regiao/ciclismo/bicicleta-single-speed-aro-700-tamanho-54-1147238086
2525,14/02,16:23,1030404483,Rodinha Lateral para Bicicleta Infantil Aro 16 Roda de Equilíbrio 8652,21.0,São José dos Campos,Centro,12245680,https://sp.olx.com.br/vale-do-paraiba-e-litoral-norte/ciclismo/rodinha-lateral-para-bicicleta-infantil-aro-16-roda-de-equilibrio-8652-1030404483
2526,14/02,15:40,1147153668,Peças para bicicleta speed single fixa,15.0,São Paulo,Vila União (Zona Leste),03683000,https://sp.olx.com.br/sao-paulo-e-regiao/ciclismo/pecas-para-bicicleta-speed-single-fixa-1147153668
2527,14/02,15:34,1147151830,Bicicleta mtb carbono Kestrel 1989,1998.0,São Paulo,Vila União (Zona Leste),03683000,https://sp.olx.com.br/sao-paulo-e-regiao/ciclismo/bicicleta-mtb-carbono-kestrel-1989-1147151830
2528,14/02,15:25,1147148981,Peças para bicicleta mtb ,15.0,São Paulo,Vila União (Zona Leste),03683000,https://sp.olx.com.br/sao-paulo-e-regiao/ciclismo/pecas-para-bicicleta-mtb-1147148981
2529,,,,,,,,,
2530,14/02,15:05,912081167,Suporte Avançado de Bike para GPS Garmin Edge Bryton Cateye e Câmera GoPro 7157,45.0,São José dos Campos,Centro,12245680,https://sp.olx.com.br/vale-do-paraiba-e-litoral-norte/ciclismo/suporte-avancado-de-bike-para-gps-garmin-edge-bryton-cateye-e-camera-gopro-7157-912081167
2531,14/02,15:05,937280899,Sinalizador com Led Jws WS-211 Recarregável USB 8 Leds Pisca Vermelho 5 Super Forte 7129,26.0,São José dos Campos,Centro,12245680,https://sp.olx.com.br/vale-do-paraiba-e-litoral-norte/ciclismo/sinalizador-com-led-jws-ws-211-recarregavel-usb-8-leds-pisca-vermelho-5-super-forte-7129-937280899
2532,14/02,14:44,1030409572,Pedal de encaixe Clip Bicicleta Mountain-Bike Shimano M520 Preto Com Taquinhos Sh-51 1277,405.0,São José dos Campos,Vila Ester,12221680,https://sp.olx.com.br/vale-do-paraiba-e-litoral-norte/ciclismo/pedal-de-encaixe-clip-bicicleta-mountain-bike-shimano-m520-preto-com-taquinhos-sh-51-1277-1030409572
2533,14/02,14:44,1028488988,Passador Shimano Deore XT M780 I-Spec 2 e 3x10 velocidades - Usado 8862,396.0,São José dos Campos,Centro,12245680,https://sp.olx.com.br/vale-do-paraiba-e-litoral-norte/ciclismo/passador-shimano-deore-xt-m780-i-spec-2-e-3x10-velocidades-usado-8862-1028488988
2534,14/02,14:44,935767055,Sinalizador Diant e Tras Epic Line EPL-2215 Bike Luz Noturna 2 Leds Branco e Vermelho 7509,17.0,São José dos Campos,Centro,12245680,https://sp.olx.com.br/vale-do-paraiba-e-litoral-norte/ciclismo/sinalizador-diant-e-tras-epic-line-epl-2215-bike-luz-noturna-2-leds-branco-e-vermelho-7509-935767055
2535,14/02,14:44,938812027,Chave Ferramenta JWS Extrator de Movimento Central Hollowtech e Chave de Cassete 7633,23.0,São José dos Campos,Centro,12245680,https://sp.olx.com.br/vale-do-paraiba-e-litoral-norte/ciclismo/chave-ferramenta-jws-extrator-de-movimento-central-hollowtech-e-chave-de-cassete-7633-938812027
2536,14/02,14:32,1048088672,Prolongador de Válvula Presta para Câmara de Ar Bicicleta Road 70mm 8835,35.0,São José dos Campos,Centro,12245680,https://sp.olx.com.br/vale-do-paraiba-e-litoral-norte/ciclismo/prolongador-de-valvula-presta-para-camara-de-ar-bicicleta-road-70mm-8835-1048088672
2537,14/02,14:32,1048128751,Sinalizador com Led Recarregável USB Led Branco/Vermelho 4 Modos Super Forte 8828,10.0,São José dos Campos,Centro,12245680,https://sp.olx.com.br/vale-do-paraiba-e-litoral-norte/ciclismo/sinalizador-com-led-recarregavel-usb-led-branco-vermelho-4-modos-super-forte-8828-1048128751
2538,,,,,,,,,
2539,14/02,13:30,935302172,Kit 2x Sinalizadores em Silicone Luz Noturna com 2 Leds Pisca Vermelho 9273,9.0,São José dos Campos,Centro,12245680,https://sp.olx.com.br/vale-do-paraiba-e-litoral-norte/ciclismo/kit-2x-sinalizadores-em-silicone-luz-noturna-com-2-leds-pisca-vermelho-9273-935302172
2540,14/02,13:30,938253421,Fita de Guidão Cor Preta p/ Bicicleta Speed Kiwi Emborrachada 2mm Espessura 9344,45.0,São José dos Campos,Centro,12245680,https://sp.olx.com.br/vale-do-paraiba-e-litoral-norte/ciclismo/fita-de-guidao-cor-preta-p-bicicleta-speed-kiwi-emborrachada-2mm-espessura-9344-938253421
2541,14/02,13:27,995892437,Suporte de Celular Veicular Carro Articulado com Ventosa para Painel ou Vidro 8365,20.0,São José dos Campos,Centro,12245680,https://sp.olx.com.br/vale-do-paraiba-e-litoral-norte/ciclismo/suporte-de-celular-veicular-carro-articulado-com-ventosa-para-painel-ou-vidro-8365-995892437
2542,14/02,13:27,924800512,Sinalizador com Led 100 Lumens Jws WS-212 Recarregável USB Led Vermelho e Branco 5365,44.0,São José dos Campos,Centro,12245680,https://sp.olx.com.br/vale-do-paraiba-e-litoral-norte/ciclismo/sinalizador-com-led-100-lumens-jws-ws-212-recarregavel-usb-led-vermelho-e-branco-5365-924800512
2543,14/02,13:25,924773056,Pedal de encaixe Clip Bike Mountain-Bike Wellgo M919 Preto C/ Taquinhos tipo Shimano 5439,271.0,São José dos Campos,Centro,12245680,https://sp.olx.com.br/vale-do-paraiba-e-litoral-norte/ciclismo/pedal-de-encaixe-clip-bike-mountain-bike-wellgo-m919-preto-c-taquinhos-tipo-shimano-5439-924773056
2544,14/02,13:25,910556925,Farol Bikes Super Led Cree T6 Bateria Recarregável 4 células Zoom e Foco Ajustável 6607,81.0,São José dos Campos,Centro,12245680,https://sp.olx.com.br/vale-do-paraiba-e-litoral-norte/ciclismo/farol-bikes-super-led-cree-t6-bateria-recarregavel-4-celulas-zoom-e-foco-ajustavel-6607-910556925
2545,,,,,,,,,
2546,14/02,13:25,931258599,Pezinho Para Bike Descanso Lateral JWS Com Regulagem Preto Aro 20 até 29 7361,33.0,São José dos Campos,Centro,12245680,https://sp.olx.com.br/vale-do-paraiba-e-litoral-norte/ciclismo/pezinho-para-bike-descanso-lateral-jws-com-regulagem-preto-aro-20-ate-29-7361-931258599
2547,14/02,13:25,996207404,"Suporte de Celular Bike e Moto Fixo no Guidão com Touchscreen Prova D'agua até 6,5"" 8355",27.0,São José dos Campos,Centro,12245680,https://sp.olx.com.br/vale-do-paraiba-e-litoral-norte/ciclismo/suporte-de-celular-bike-e-moto-fixo-no-guidao-com-touchscreen-prova-d-agua-ate-6-5-8355-996207404
2548,14/02,13:25,938805621,Lanterna WS-205 800 Lúmens e Sinalizador Led WS-207 Vermelho Amarelo Recarregável 7605,87.0,São José dos Campos,Centro,12245680,https://sp.olx.com.br/vale-do-paraiba-e-litoral-norte/ciclismo/lanterna-ws-205-800-lumens-e-sinalizador-led-ws-207-vermelho-amarelo-recarregavel-7605-938805621
2549,14/02,13:25,931691043,Sinalizador Diant e Tras Jws JY009 Bike Silicone Luz Noturna 2 Leds Branco e Vermelho 7131,17.0,São José dos Campos,Centro,12245680,https://sp.olx.com.br/vale-do-paraiba-e-litoral-norte/ciclismo/sinalizador-diant-e-tras-jws-jy009-bike-silicone-luz-noturna-2-leds-branco-e-vermelho-7131-931691043
2550,14/02,13:13,945762338,Pedal de encaixe Clip Mountain-Bike Vicini MT530 Preto Com Taquinhos tipo Shiman (9106),180.0,São José dos Campos,Centro,12245680,https://sp.olx.com.br/vale-do-paraiba-e-litoral-norte/ciclismo/pedal-de-encaixe-clip-mountain-bike-vicini-mt530-preto-com-taquinhos-tipo-shiman-9106-945762338
2551,14/02,13:13,923521572,Lanterna Farol Dianteiro para Bike Jws JY-263 Super Led Preto Recarregável 5377,72.0,São José dos Campos,Centro,12245680,https://sp.olx.com.br/vale-do-paraiba-e-litoral-norte/ciclismo/lanterna-farol-dianteiro-para-bike-jws-jy-263-super-led-preto-recarregavel-5377-923521572
2552,14/02,13:13,1039262172,Abraçadeira Para Passadores de Marchas Sram Trigger Shifter XX1 X01 X0 X9 X7 Eagle 5665,24.0,São José dos Campos,Vila Ester,12221680,https://sp.olx.com.br/vale-do-paraiba-e-litoral-norte/ciclismo/abracadeira-para-passadores-de-marchas-sram-trigger-shifter-xx1-x01-x0-x9-x7-eagle-5665-1039262172
2553,,,,,,,,,
2554,14/02,11:37,1037356762,Guia de Cabo de Câmbio Para Quadro de Bicicleta Speed/MTB Fixação Movimento Central 8613,3.0,São José dos Campos,Vila Ester,12221680,https://sp.olx.com.br/vale-do-paraiba-e-litoral-norte/ciclismo/guia-de-cabo-de-cambio-para-quadro-de-bicicleta-speed-mtb-fixacao-movimento-central-8613-1037356762
2555,14/02,11:37,1037281317,Sinalizador Led Jws WS-206 Recarregável USB 5 Leds Pisca Vermelho 4 Modos Super Forte 8633,15.0,São José dos Campos,Vila Ester,12221680,https://sp.olx.com.br/vale-do-paraiba-e-litoral-norte/ciclismo/sinalizador-led-jws-ws-206-recarregavel-usb-5-leds-pisca-vermelho-4-modos-super-forte-8633-1037281317
2556,14/02,11:37,909433819,Ferramenta de Reparo Macarrão Para Pneu Tubeless para Bike com Agulha ArStop 3776,52.0,São José dos Campos,Centro,12245680,https://sp.olx.com.br/vale-do-paraiba-e-litoral-norte/ciclismo/ferramenta-de-reparo-macarrao-para-pneu-tubeless-para-bike-com-agulha-arstop-3776-909433819
2557,14/02,11:37,914853771,Chave Jws Instalação Movimento Central Hollowtech Shimano Truvativ Fsa Megaexo 7363,23.0,São José dos Campos,Centro,12245680,https://sp.olx.com.br/vale-do-paraiba-e-litoral-norte/ciclismo/chave-jws-instalacao-movimento-central-hollowtech-shimano-truvativ-fsa-megaexo-7363-914853771
2558,14/02,11:15,1147032139,Bike MTB 29 VZAN,3000.0,São Paulo,Cambuci,01543000,https://sp.olx.com.br/sao-paulo-e-regiao/ciclismo/bike-mtb-29-vzan-1147032139
2559,14/02,11:05,935306727,GPS Ciclocomputador para Bikes Absolute Nero Compatível com Strava 7229,180.0,São José dos Campos,Centro,12245680,https://sp.olx.com.br/vale-do-paraiba-e-litoral-norte/ciclismo/gps-ciclocomputador-para-bikes-absolute-nero-compativel-com-strava-7229-935306727
2560,,,,,,,,,
2561,14/02,11:04,930648229,Sinalizador Diant Traseiro Vortex Bike Silicone Luz Noturna 2 Leds Branco e Vermelho 7077,21.0,São José dos Campos,Centro,12245680,https://sp.olx.com.br/vale-do-paraiba-e-litoral-norte/ciclismo/sinalizador-diant-traseiro-vortex-bike-silicone-luz-noturna-2-leds-branco-e-vermelho-7077-930648229
2562,14/02,11:04,1028440067,Bolsa de Banco Selim para Bicicleta Marca B-Soul Para Ferramentas e Acessórios 9021,36.0,São José dos Campos,Centro,12245680,https://sp.olx.com.br/vale-do-paraiba-e-litoral-norte/ciclismo/bolsa-de-banco-selim-para-bicicleta-marca-b-soul-para-ferramentas-e-acessorios-9021-1028440067
2563,14/02,11:03,1028116814, Pedivela Triplo Bicicleta Mtb Absolute 170mm Preto 170 42/34/24 Dentes (9080),54.0,São José dos Campos,Centro,12245680,https://sp.olx.com.br/vale-do-paraiba-e-litoral-norte/ciclismo/pedivela-triplo-bicicleta-mtb-absolute-170mm-preto-170-42-34-24-dentes-9080-1028116814
2564,14/02,10:52,1029032559,Rodinha Lateral para Bicicleta Infantil Aro 20 Roda de Equilíbrio 8900,23.0,São José dos Campos,Vila Ester,12221680,https://sp.olx.com.br/vale-do-paraiba-e-litoral-norte/ciclismo/rodinha-lateral-para-bicicleta-infantil-aro-20-roda-de-equilibrio-8900-1029032559
2565,14/02,10:52,1032023650,"Bolsa Porta Celular Para Guidão de Bicicleta B-Soul com Visor até 6,4 polegadas 9011",50.0,São José dos Campos,Vila Ester,12221680,https://sp.olx.com.br/vale-do-paraiba-e-litoral-norte/ciclismo/bolsa-porta-celular-para-guidao-de-bicicleta-b-soul-com-visor-ate-6-4-polegadas-9011-1032023650
2566,14/02,10:50,1030861783,Sinalizador Led 70 Lumens Jws WS-096 Recarregável USB Led Vermelho/Branco 6 Modos 7127,49.0,São José dos Campos,Vila Ester,12221680,https://sp.olx.com.br/vale-do-paraiba-e-litoral-norte/ciclismo/sinalizador-led-70-lumens-jws-ws-096-recarregavel-usb-led-vermelho-branco-6-modos-7127-1030861783
2567,14/02,10:50,926390052,Sinalizador Diant e Tras Absolute JY-267 para Bike Silicone c 2 Leds Branco Vermelho 6985,23.0,São José dos Campos,Centro,12245680,https://sp.olx.com.br/vale-do-paraiba-e-litoral-norte/ciclismo/sinalizador-diant-e-tras-absolute-jy-267-para-bike-silicone-c-2-leds-branco-vermelho-6985-926390052
2568,14/02,10:41,950051207,Garupa Bagageiro Traseiro Bicicleta Kalf Serve em Aro 26-29 Flex Reforçado 9113,90.0,São José dos Campos,Centro,12245680,https://sp.olx.com.br/vale-do-paraiba-e-litoral-norte/ciclismo/garupa-bagageiro-traseiro-bicicleta-kalf-serve-em-aro-26-29-flex-reforcado-9113-950051207
2569,14/02,10:41,926858217,Sinalizador com Led Jws Ws-207 Recarregável usb 7 Leds Vermelho Amarelo 4 Modos 7133,26.0,São José dos Campos,Centro,12245680,https://sp.olx.com.br/vale-do-paraiba-e-litoral-norte/ciclismo/sinalizador-com-led-jws-ws-207-recarregavel-usb-7-leds-vermelho-amarelo-4-modos-7133-926858217
2570,14/02,10:39,923954794,Roda Livre Catraca Pinhão 18 Dentes p/ Cubo Traseiro Rosca Corrente Grossa 9203,13.0,São José dos Campos,Centro,12245680,https://sp.olx.com.br/vale-do-paraiba-e-litoral-norte/ciclismo/roda-livre-catraca-pinhao-18-dentes-p-cubo-traseiro-rosca-corrente-grossa-9203-923954794
2571,13/02,22:28,1083145521,Bicicleta MTB Sense One 21v 2021/2022 - Nova na caixa,2290.0,São Paulo,Indianópolis,04062003,https://sp.olx.com.br/sao-paulo-e-regiao/ciclismo/bicicleta-mtb-sense-one-21v-2021-2022-nova-na-caixa-1083145521
2572,13/02,21:18,1083778543,Bicicleta Urbana Feminina Groove Cosmopolitan Easy Step 7v 2021 - Nova na caixa,2199.0,São Paulo,Indianópolis,04062003,https://sp.olx.com.br/sao-paulo-e-regiao/ciclismo/bicicleta-urbana-feminina-groove-cosmopolitan-easy-step-7v-2021-nova-na-caixa-1083778543
2573,13/02,10:59,1146568551,Caloi 10 1983,1100.0,Santos,Embaré,11040240,https://sp.olx.com.br/baixada-santista-e-litoral-sul/ciclismo/caloi-10-1983-1146568551
2574,13/02,08:56,1146509875,Rolo de treinamento Absolulte Wild 5,320.0,São Paulo,Santo Amaro,04743030,https://sp.olx.com.br/sao-paulo-e-regiao/ciclismo/rolo-de-treinamento-absolulte-wild-5-1146509875
2575,13/02,08:55,1146509467,Caloi Peri 1979,800.0,Santos,Embaré,11040240,https://sp.olx.com.br/baixada-santista-e-litoral-sul/ciclismo/caloi-peri-1979-1146509467
2576,09/02,16:31,1125060356,Porta Bike Teto Velox Eqmax / semi novo,300.0,São Paulo,Campo Belo,04608000,https://sp.olx.com.br/sao-paulo-e-regiao/ciclismo/porta-bike-teto-velox-eqmax-semi-novo-1125060356
2577,09/02,07:47,1144915265,Capacete bike Wavecell Bontrager ,780.0,Catanduva,Residencial Nova Catanduva I,15813285,https://sp.olx.com.br/regiao-de-sao-jose-do-rio-preto/ciclismo/capacete-bike-wavecell-bontrager-1144915265
2578,,,,,,,,,
2579,08/02,22:31,1135591000,Fixador de Pezinho de Bike,20.0,Taubaté,Jardim dos Estados,12062400,https://sp.olx.com.br/vale-do-paraiba-e-litoral-norte/ciclismo/fixador-de-pezinho-de-bike-1135591000
2580,08/02,22:30,1144816934,Bike 29 Oggi velloce Disc kit Shimano Claris tamanho 56,4999.0,São Paulo,Jardim Líbano,05138200,https://sp.olx.com.br/sao-paulo-e-regiao/ciclismo/bike-29-oggi-velloce-disc-kit-shimano-claris-tamanho-56-1144816934
2581,08/02,21:05,1083771417,Bicicleta Urbana Groove Urban ID 21v 2021 - Nova na caixa,2999.0,São Paulo,Indianópolis,04062003,https://sp.olx.com.br/sao-paulo-e-regiao/ciclismo/bicicleta-urbana-groove-urban-id-21v-2021-nova-na-caixa-1083771417
2582,08/02,18:31,1144713981,Bike fixa ,1000.0,São Paulo,Santana,02035011,https://sp.olx.com.br/sao-paulo-e-regiao/ciclismo/bike-fixa-1144713981
2583,08/02,12:21,1144508855,Bike fixa airwalk,1900.0,São Paulo,República,01220010,https://sp.olx.com.br/sao-paulo-e-regiao/ciclismo/bike-fixa-airwalk-1144508855
2584,07/02,18:35,1144184715,"Garfo Tange 1"" Cromoly",400.0,São Paulo,Imirim,02467060,https://sp.olx.com.br/sao-paulo-e-regiao/ciclismo/garfo-tange-1-cromoly-1144184715
2585,,,,,,,,,
2586,07/02,15:23,1144098636,Conjunto de lanterna para Bike BTWIN,80.0,São Paulo,Imirim,02465000,https://sp.olx.com.br/sao-paulo-e-regiao/ciclismo/conjunto-de-lanterna-para-bike-btwin-1144098636
2587,07/02,13:56,1144046716,Roda Traseira Flay 29 Rims Aero Race com Tecnologia Tubeless ou Camera de ar.,130.0,Campinas,Jardim Florence,13059044,https://sp.olx.com.br/grande-campinas/ciclismo/roda-traseira-flay-29-rims-aero-race-com-tecnologia-tubeless-ou-camera-de-ar-1144046716
2588,07/02,13:26,1144033639,Folha Aro 29 Aero Rims Aero Race P/freio A Disco Flay 32 ou 36 Furos tubeless,45.0,Campinas,Jardim Florence,13059044,https://sp.olx.com.br/grande-campinas/ciclismo/folha-aro-29-aero-rims-aero-race-p-freio-a-disco-flay-32-ou-36-furos-tubeless-1144033639
2589,07/02,10:55,1143959709,Bicicleta Sense One 2023 Aro 29 Cinza/Aqua- Nova,2290.0,São Manuel,Jardim Progresso,18652168,https://sp.olx.com.br/regiao-de-bauru-e-marilia/ciclismo/bicicleta-sense-one-2023-aro-29-cinza-aqua-nova-1143959709
2590,07/02,10:20,1143940744,Capacete De Bike Ciclismo - Com Led E Regulagem,60.0,São Paulo,Vila Aricanduva,03507010,https://sp.olx.com.br/sao-paulo-e-regiao/ciclismo/capacete-de-bike-ciclismo-com-led-e-regulagem-1143940744
2591,07/02,06:38,1143862647,Bicicleta Soul expresso single speed ou fixed gear,2800.0,Santa Bárbara D'Oeste,Jardim Santa Rita de Cássia,13457093,https://sp.olx.com.br/grande-campinas/ciclismo/bicicleta-soul-expresso-single-speed-ou-fixed-gear-1143862647
2592,06/02,19:34,1143705147,Levabike 3hm Transbike Suporte Rack Teto Ventosa Bike,890.0,São Bernardo do Campo,Vila Gonçalves,09725120,https://sp.olx.com.br/sao-paulo-e-regiao/ciclismo/levabike-3hm-transbike-suporte-rack-teto-ventosa-bike-1143705147
2593,06/02,14:03,1143550203,Sinalizador Dianteiro e Traseiro Absolute JY-267 para Bike Silicone com 2 Leds Branco Verm,29.0,São José dos Campos,Conjunto Residencial Trinta e Um de Março,12237010,https://sp.olx.com.br/vale-do-paraiba-e-litoral-norte/ciclismo/sinalizador-dianteiro-e-traseiro-absolute-jy-267-para-bike-silicone-com-2-leds-branco-verm-1143550203
2594,,,,,,,,,
2595,06/02,13:01,1134683456,bike spinning racing profissional pelegrin pel-2311 usada,1369.0,São Paulo,Vila Mariana,04018030,https://sp.olx.com.br/sao-paulo-e-regiao/ciclismo/bike-spinning-racing-profissional-pelegrin-pel-2311-usada-1134683456
2596,05/02,22:01,1134030786,03 rolos treino bike - roller training,120.0,São Paulo,Ibirapuera,04501010,https://sp.olx.com.br/sao-paulo-e-regiao/ciclismo/03-rolos-treino-bike-roller-training-1134030786
2597,05/02,20:11,1143264395,Garfo alumínio para Bike Speed<br>Praticamente Sem Uso,280.0,São Paulo,Vila Andrade,05718290,https://sp.olx.com.br/sao-paulo-e-regiao/ciclismo/garfo-aluminio-para-bike-speed-br-praticamente-sem-uso-1143264395
2598,05/02,18:01,1134105845,Montain Bike Audax Havok Sx - Aro-29 Tam17 Preto - 2021.,1800.0,Bragança Paulista,Condomínio Residencial Rosário de Fátima,12919601,https://sp.olx.com.br/sao-paulo-e-regiao/ciclismo/montain-bike-audax-havok-sx-aro-29-tam17-preto-2021-1134105845
2599,04/02,23:42,1102501925,Bicicleta Elétrica Urbana Caloi E-Vibe Easy Rider 2020,8199.0,São Paulo,Indianópolis,04062003,https://sp.olx.com.br/sao-paulo-e-regiao/ciclismo/bicicleta-eletrica-urbana-caloi-e-vibe-easy-rider-2020-1102501925
2600,04/02,19:03,1142951997,Cadeirinha para bicicleta,150.0,Sorocaba,Vila Haro,18015000,https://sp.olx.com.br/regiao-de-sorocaba/ciclismo/cadeirinha-para-bicicleta-1142951997
2601,,,,,,,,,
2602,04/02,08:37,1142707219,Kit Lanterna e Farol Recarregável Bicicleta Bike Luz Ultra Led a Prova D'água,50.0,Marília,Jardim Santa Antonieta,17512390,https://sp.olx.com.br/regiao-de-bauru-e-marilia/ciclismo/kit-lanterna-e-farol-recarregavel-bicicleta-bike-luz-ultra-led-a-prova-d-agua-1142707219
2603,03/02,21:31,1133630520,Cadeirinha Infantil Bicicleta Kalf Baby Bike Dianteira Preta,180.0,São Paulo,Parque Cruzeiro do Sul,08070170,https://sp.olx.com.br/sao-paulo-e-regiao/ciclismo/cadeirinha-infantil-bicicleta-kalf-baby-bike-dianteira-preta-1133630520
2604,03/02,12:40,1142362809,Bicicleta Aluminio Aro 29 Freios Hidráulico 21M Shimano Suspensão Cores Tamanhos Variados,1099.0,Ribeirão Pires,Centro,09400110,https://sp.olx.com.br/sao-paulo-e-regiao/ciclismo/bicicleta-aluminio-aro-29-freios-hidraulico-21m-shimano-suspensao-cores-tamanhos-variados-1142362809
