,dayPost,timePost,codeAd,nameBike,valueBike,city,neighborhood,cep,urlBike
1823,17/07,13:04,1038981039,"Bicicleta Raio Saturno Azul - 29"" + Kit pedal",0.0,São Bernardo do Campo,Planalto,09895670,https://sp.olx.com.br/sao-paulo-e-regiao/ciclismo/bicicleta-raio-saturno-azul-29-kit-pedal-1038981039
1824,17/07,13:00,1059345315,Rolo treino bike suporte bicicleta dobrável fixo ciclismo ,0.0,Campinas,Ponte Preta,13041620,https://sp.olx.com.br/grande-campinas/ciclismo/rolo-treino-bike-suporte-bicicleta-dobravel-fixo-ciclismo-1059345315
1825,,,,,,,,,
1826,16/07,19:07,1059192827,"Suporte p/ Bicicleta marca Kiussi, mod Etna - prata ( de R$ 590 por 400 ! )",0.0,São Paulo,Vila Mariana,04019000,https://sp.olx.com.br/sao-paulo-e-regiao/ciclismo/suporte-p-bicicleta-marca-kiussi-mod-etna-prata-de-r-590-por-400-1059192827
1827,15/07,21:22,1058873860,BICICLETA CALOI FIORENTINA 1960,0.0,São Paulo,Vila Gomes Cardim,03319002,https://sp.olx.com.br/sao-paulo-e-regiao/ciclismo/bicicleta-caloi-fiorentina-1960-1058873860
1828,15/07,19:43,1058845459,Monark 10 Single Speed,0.0,Santos,Embaré,11040240,https://sp.olx.com.br/baixada-santista-e-litoral-sul/ciclismo/monark-10-single-speed-1058845459
1829,14/07,19:32,1049290578,Bike Fixa Caloi 10,0.0,Suzano,Centro,08674100,https://sp.olx.com.br/sao-paulo-e-regiao/ciclismo/bike-fixa-caloi-10-1049290578
1830,14/07,14:02,1058167014,Alforje thule shield ,0.0,Taubaté,Centro,12020060,https://sp.olx.com.br/vale-do-paraiba-e-litoral-norte/ciclismo/alforje-thule-shield-1058167014
1831,14/07,00:46,1057862354,Bicicleta Aro 29 ,0.0,São Paulo,Parque América,04822000,https://sp.olx.com.br/sao-paulo-e-regiao/ciclismo/bicicleta-aro-29-1057862354
1832,,,,,,,,,
1833,13/07,23:07,1057844881,Bike bicicleta Fixa,0.0,Sumaré,Residencial Guairá,13173524,https://sp.olx.com.br/grande-campinas/ciclismo/bike-bicicleta-fixa-1057844881
1834,13/07,23:01,1037256848,Farol Bike Led com Buzina Recarregável [Vermelho]<br><br>Produto novo ,0.0,São José dos Campos,Jardim Satélite,12230730,https://sp.olx.com.br/vale-do-paraiba-e-litoral-norte/ciclismo/farol-bike-led-com-buzina-recarregavel-vermelho-br-br-produto-novo-1037256848
1835,13/07,18:31,1048684518,Sinalizador Traseira de Bike USB Alto Brilho (Luz 2 Cores Vermelho/Branco) Recarregável,0.0,Presidente Prudente,Vila Tazitsu,19023000,https://sp.olx.com.br/regiao-de-presidente-prudente/ciclismo/sinalizador-traseira-de-bike-usb-alto-brilho-luz-2-cores-vermelho-branco-recarregavel-1048684518
1836,13/07,16:40,940931396,Bicicleta Urbana Groove Blues MD 21v 2021 - Nova na caixa,0.0,São Paulo,Indianópolis,04062003,https://sp.olx.com.br/sao-paulo-e-regiao/ciclismo/bicicleta-urbana-groove-blues-md-21v-2021-nova-na-caixa-940931396
1837,13/07,16:39,979526785,Bicicleta Urbana Groove Urban ID 21v 2021 - Nova na caixa,0.0,São Paulo,Indianópolis,04062003,https://sp.olx.com.br/sao-paulo-e-regiao/ciclismo/bicicleta-urbana-groove-urban-id-21v-2021-nova-na-caixa-979526785
1838,13/07,16:33,921212986,Bicicleta Urbana Groove Cosmopolitan 7v 2021 - Nova na caixa,0.0,São Paulo,Indianópolis,04062003,https://sp.olx.com.br/sao-paulo-e-regiao/ciclismo/bicicleta-urbana-groove-cosmopolitan-7v-2021-nova-na-caixa-921212986
1839,13/07,15:55,1057639296,Bicicleta de Equilíbrio Runna Bike Azul,0.0,São Paulo,Parque Panamericano,02992210,https://sp.olx.com.br/sao-paulo-e-regiao/ciclismo/bicicleta-de-equilibrio-runna-bike-azul-1057639296
1840,13/07,14:29,1057599502,Bike aro 29 Tsw Stamina grupo Shimano 18v Alívio ,0.0,São Paulo,Jardim Líbano,05138200,https://sp.olx.com.br/sao-paulo-e-regiao/ciclismo/bike-aro-29-tsw-stamina-grupo-shimano-18v-alivio-1057599502
1841,13/07,13:24,1028878100,Sinalizador Diant. e Tras. JWS Bicicletas Silicone Luz 2 Leds Branco e Vermelho 5363,0.0,São José dos Campos,Vila Ester,12221680,https://sp.olx.com.br/vale-do-paraiba-e-litoral-norte/ciclismo/sinalizador-diant-e-tras-jws-bicicletas-silicone-luz-2-leds-branco-e-vermelho-5363-1028878100
1842,13/07,13:23,1029015574,Sinalizador com Led Jws JY-918 Recarregável USB Led Vermelho 4 Modos Super Forte 5367,0.0,São José dos Campos,Vila Ester,12221680,https://sp.olx.com.br/vale-do-paraiba-e-litoral-norte/ciclismo/sinalizador-com-led-jws-jy-918-recarregavel-usb-led-vermelho-4-modos-super-forte-5367-1029015574
1843,13/07,13:22,1029485139,Farol Lanterna Bicicleta Led Cree T6 com Zoom Super Forte Bateria Externa 6 células 8391,0.0,São José dos Campos,Centro,12245680,https://sp.olx.com.br/vale-do-paraiba-e-litoral-norte/ciclismo/farol-lanterna-bicicleta-led-cree-t6-com-zoom-super-forte-bateria-externa-6-celulas-8391-1029485139
1844,13/07,13:21,1028475977,Sensor De Velocidade Garmin ANT+ Para Bicicleta Ideal para uso em Rolo de Treino 8675,0.0,São José dos Campos,Centro,12245680,https://sp.olx.com.br/vale-do-paraiba-e-litoral-norte/ciclismo/sensor-de-velocidade-garmin-ant-para-bicicleta-ideal-para-uso-em-rolo-de-treino-8675-1028475977
1845,13/07,13:20,1030861783,Sinalizador Led 70 Lumens Jws WS-096 Recarregável USB Led Vermelho/Branco 6 Modos 7127,0.0,São José dos Campos,Vila Ester,12221680,https://sp.olx.com.br/vale-do-paraiba-e-litoral-norte/ciclismo/sinalizador-led-70-lumens-jws-ws-096-recarregavel-usb-led-vermelho-branco-6-modos-7127-1030861783
1846,13/07,13:14,1028488988,Passador Shimano Deore XT M780 I-Spec 2 e 3x10 velocidades - Usado 8862,0.0,São José dos Campos,Centro,12245680,https://sp.olx.com.br/vale-do-paraiba-e-litoral-norte/ciclismo/passador-shimano-deore-xt-m780-i-spec-2-e-3x10-velocidades-usado-8862-1028488988
1847,13/07,13:08,1030404483,Rodinha Lateral para Bicicleta Infantil Aro 16 Roda de Equilíbrio 8652,0.0,São José dos Campos,Centro,12245680,https://sp.olx.com.br/vale-do-paraiba-e-litoral-norte/ciclismo/rodinha-lateral-para-bicicleta-infantil-aro-16-roda-de-equilibrio-8652-1030404483
1848,13/07,13:04,1030409572,Pedal de encaixe Clip Bicicleta Mountain-Bike Shimano M520 Preto Com Taquinhos Sh-51 1277,0.0,São José dos Campos,Vila Ester,12221680,https://sp.olx.com.br/vale-do-paraiba-e-litoral-norte/ciclismo/pedal-de-encaixe-clip-bicicleta-mountain-bike-shimano-m520-preto-com-taquinhos-sh-51-1277-1030409572
1849,13/07,12:34,930587776,Farol para Bikes Jws WS-112W com Super Led Cree T6 Bateria Recarregável de 6 células 7639,0.0,São José dos Campos,Centro,12245680,https://sp.olx.com.br/vale-do-paraiba-e-litoral-norte/ciclismo/farol-para-bikes-jws-ws-112w-com-super-led-cree-t6-bateria-recarregavel-de-6-celulas-7639-930587776
1850,,,,,,,,,
1851,13/07,12:34,926390052,Sinalizador Diant e Tras Absolute JY-267 para Bike Silicone c 2 Leds Branco Vermelho 6985,0.0,São José dos Campos,Centro,12245680,https://sp.olx.com.br/vale-do-paraiba-e-litoral-norte/ciclismo/sinalizador-diant-e-tras-absolute-jy-267-para-bike-silicone-c-2-leds-branco-vermelho-6985-926390052
1852,13/07,12:27,1040308131,Pedal de encaixe Clip Bicicleta Mountain-Bike Wellgo M919 Preto (Usado) 8788,0.0,São José dos Campos,Vila Ester,12221680,https://sp.olx.com.br/vale-do-paraiba-e-litoral-norte/ciclismo/pedal-de-encaixe-clip-bicicleta-mountain-bike-wellgo-m919-preto-usado-8788-1040308131
1853,13/07,12:14,926858217,Sinalizador com Led Jws Ws-207 Recarregável usb 7 Leds Vermelho Amarelo 4 Modos 7133,0.0,São José dos Campos,Centro,12245680,https://sp.olx.com.br/vale-do-paraiba-e-litoral-norte/ciclismo/sinalizador-com-led-jws-ws-207-recarregavel-usb-7-leds-vermelho-amarelo-4-modos-7133-926858217
1854,13/07,11:30,1032019710,Sinalizador Epic Line XC-782 Diant. e Tras. Silicone com Led Luz Noturna de Segurança 7511,0.0,São José dos Campos,Vila Ester,12221680,https://sp.olx.com.br/vale-do-paraiba-e-litoral-norte/ciclismo/sinalizador-epic-line-xc-782-diant-e-tras-silicone-com-led-luz-noturna-de-seguranca-7511-1032019710
1855,12/07,18:11,1048161260,"Bike Speed, catraca fixa também ",0.0,São Paulo,Jardim Vergueiro (Sacomã),04166003,https://sp.olx.com.br/sao-paulo-e-regiao/ciclismo/bike-speed-catraca-fixa-tambem-1048161260
1856,12/07,14:43,1057042925,Caloi 10 1986 ,0.0,Santos,Embaré,11040240,https://sp.olx.com.br/baixada-santista-e-litoral-sul/ciclismo/caloi-10-1986-1057042925
1857,,,,,,,,,
1858,12/07,14:40,1036323055,Fita de Guidão Genesi para Bicicletas Speed Road Gravel Cor Preta em EVA Macio 8371,0.0,São José dos Campos,Vila Ester,12221680,https://sp.olx.com.br/vale-do-paraiba-e-litoral-norte/ciclismo/fita-de-guidao-genesi-para-bicicletas-speed-road-gravel-cor-preta-em-eva-macio-8371-1036323055
1859,12/07,14:38,937280899,Sinalizador com Led Jws WS-211 Recarregável USB 8 Leds Pisca Vermelho 5 Super Forte 7129,0.0,São José dos Campos,Centro,12245680,https://sp.olx.com.br/vale-do-paraiba-e-litoral-norte/ciclismo/sinalizador-com-led-jws-ws-211-recarregavel-usb-8-leds-pisca-vermelho-5-super-forte-7129-937280899
1860,12/07,14:37,912081167,Suporte Avançado de Bike para GPS Garmin Edge Bryton Cateye e Câmera GoPro 7157,0.0,São José dos Campos,Centro,12245680,https://sp.olx.com.br/vale-do-paraiba-e-litoral-norte/ciclismo/suporte-avancado-de-bike-para-gps-garmin-edge-bryton-cateye-e-camera-gopro-7157-912081167
1861,12/07,14:12,938812027,Chave Ferramenta JWS Extrator de Movimento Central Hollowtech e Chave de Cassete 7633,0.0,São José dos Campos,Centro,12245680,https://sp.olx.com.br/vale-do-paraiba-e-litoral-norte/ciclismo/chave-ferramenta-jws-extrator-de-movimento-central-hollowtech-e-chave-de-cassete-7633-938812027
1862,12/07,14:12,935767055,Sinalizador Diant e Tras Epic Line EPL-2215 Bike Luz Noturna 2 Leds Branco e Vermelho 7509,0.0,São José dos Campos,Centro,12245680,https://sp.olx.com.br/vale-do-paraiba-e-litoral-norte/ciclismo/sinalizador-diant-e-tras-epic-line-epl-2215-bike-luz-noturna-2-leds-branco-e-vermelho-7509-935767055
1863,12/07,13:13,930648229,Sinalizador Diant Traseiro Vortex Bike Silicone Luz Noturna 2 Leds Branco e Vermelho 7077,0.0,São José dos Campos,Centro,12245680,https://sp.olx.com.br/vale-do-paraiba-e-litoral-norte/ciclismo/sinalizador-diant-traseiro-vortex-bike-silicone-luz-noturna-2-leds-branco-e-vermelho-7077-930648229
1864,12/07,13:09,935306727,GPS Ciclocomputador para Bikes Absolute Nero Compatível com Strava 7229,0.0,São José dos Campos,Centro,12245680,https://sp.olx.com.br/vale-do-paraiba-e-litoral-norte/ciclismo/gps-ciclocomputador-para-bikes-absolute-nero-compativel-com-strava-7229-935306727
1865,12/07,12:51,909433819,Ferramenta de Reparo Macarrão Para Pneu Tubeless para Bike com Agulha ArStop 3776,0.0,São José dos Campos,Centro,12245680,https://sp.olx.com.br/vale-do-paraiba-e-litoral-norte/ciclismo/ferramenta-de-reparo-macarrao-para-pneu-tubeless-para-bike-com-agulha-arstop-3776-909433819
1866,,,,,,,,,
1867,12/07,12:50,914853771,Chave Jws Instalação Movimento Central Hollowtech Shimano Truvativ Fsa Megaexo 7363,0.0,São José dos Campos,Centro,12245680,https://sp.olx.com.br/vale-do-paraiba-e-litoral-norte/ciclismo/chave-jws-instalacao-movimento-central-hollowtech-shimano-truvativ-fsa-megaexo-7363-914853771
1868,12/07,12:45,1037281317,Sinalizador Led Jws WS-206 Recarregável USB 5 Leds Pisca Vermelho 4 Modos Super Forte 8633,0.0,São José dos Campos,Vila Ester,12221680,https://sp.olx.com.br/vale-do-paraiba-e-litoral-norte/ciclismo/sinalizador-led-jws-ws-206-recarregavel-usb-5-leds-pisca-vermelho-4-modos-super-forte-8633-1037281317
1869,12/07,12:40,1037356762,Guia de Cabo de Câmbio Para Quadro de Bicicleta Speed/MTB Fixação Movimento Central 8613,0.0,São José dos Campos,Vila Ester,12221680,https://sp.olx.com.br/vale-do-paraiba-e-litoral-norte/ciclismo/guia-de-cabo-de-cambio-para-quadro-de-bicicleta-speed-mtb-fixacao-movimento-central-8613-1037356762
1870,12/07,12:36,1039262172,Abraçadeira Para Passadores de Marchas Sram Trigger Shifter XX1 X01 X0 X9 X7 Eagle 5665,0.0,São José dos Campos,Vila Ester,12221680,https://sp.olx.com.br/vale-do-paraiba-e-litoral-norte/ciclismo/abracadeira-para-passadores-de-marchas-sram-trigger-shifter-xx1-x01-x0-x9-x7-eagle-5665-1039262172
1871,12/07,12:36,1039262931,Adaptador De Freio À Disco Shimano IS Para Post Mount Rotor 180/160mm 6505,0.0,São José dos Campos,Vila Ester,12221680,https://sp.olx.com.br/vale-do-paraiba-e-litoral-norte/ciclismo/adaptador-de-freio-disco-shimano-is-para-post-mount-rotor-180-160mm-6505-1039262931
1872,12/07,12:25,945752121,Kit Lanterna Dianteira Bike WS-205 e Sinalizador Traseiro JY-918 JWS Recarregável 7607,0.0,São José dos Campos,Centro,12245680,https://sp.olx.com.br/vale-do-paraiba-e-litoral-norte/ciclismo/kit-lanterna-dianteira-bike-ws-205-e-sinalizador-traseiro-jy-918-jws-recarregavel-7607-945752121
1873,,,,,,,,,
1874,12/07,12:25,931258599,Pezinho Para Bike Descanso Lateral JWS Com Regulagem Preto Aro 20 até 29 7361,0.0,São José dos Campos,Centro,12245680,https://sp.olx.com.br/vale-do-paraiba-e-litoral-norte/ciclismo/pezinho-para-bike-descanso-lateral-jws-com-regulagem-preto-aro-20-ate-29-7361-931258599
1875,12/07,12:24,996207404,"Suporte de Celular Bike e Moto Fixo no Guidão com Touchscreen Prova D'agua até 6,5"" 8355",0.0,São José dos Campos,Centro,12245680,https://sp.olx.com.br/vale-do-paraiba-e-litoral-norte/ciclismo/suporte-de-celular-bike-e-moto-fixo-no-guidao-com-touchscreen-prova-d-agua-ate-6-5-8355-996207404
1876,12/07,12:22,938805621,Lanterna WS-205 800 Lúmens e Sinalizador Led WS-207 Vermelho Amarelo Recarregável 7605,0.0,São José dos Campos,Centro,12245680,https://sp.olx.com.br/vale-do-paraiba-e-litoral-norte/ciclismo/lanterna-ws-205-800-lumens-e-sinalizador-led-ws-207-vermelho-amarelo-recarregavel-7605-938805621
1877,12/07,12:22,931691043,Sinalizador Diant e Tras Jws JY009 Bike Silicone Luz Noturna 2 Leds Branco e Vermelho 7131,0.0,São José dos Campos,Centro,12245680,https://sp.olx.com.br/vale-do-paraiba-e-litoral-norte/ciclismo/sinalizador-diant-e-tras-jws-jy009-bike-silicone-luz-noturna-2-leds-branco-e-vermelho-7131-931691043
1878,12/07,12:12,995892437,Suporte de Celular Veicular Carro Articulado com Ventosa para Painel ou Vidro 8365,0.0,São José dos Campos,Centro,12245680,https://sp.olx.com.br/vale-do-paraiba-e-litoral-norte/ciclismo/suporte-de-celular-veicular-carro-articulado-com-ventosa-para-painel-ou-vidro-8365-995892437
1879,12/07,12:09,923521572,Lanterna Farol Dianteiro para Bike Jws JY-263 Super Led Preto Recarregável 5377,0.0,São José dos Campos,Centro,12245680,https://sp.olx.com.br/vale-do-paraiba-e-litoral-norte/ciclismo/lanterna-farol-dianteiro-para-bike-jws-jy-263-super-led-preto-recarregavel-5377-923521572
1880,12/07,12:09,924800512,Sinalizador com Led 100 Lumens Jws WS-212 Recarregável USB Led Vermelho e Branco 5365,0.0,São José dos Campos,Centro,12245680,https://sp.olx.com.br/vale-do-paraiba-e-litoral-norte/ciclismo/sinalizador-com-led-100-lumens-jws-ws-212-recarregavel-usb-led-vermelho-e-branco-5365-924800512
1881,,,,,,,,,
1882,12/07,12:04,924773056,Pedal de encaixe Clip Bike Mountain-Bike Wellgo M919 Preto C/ Taquinhos tipo Shimano 5439,0.0,São José dos Campos,Centro,12245680,https://sp.olx.com.br/vale-do-paraiba-e-litoral-norte/ciclismo/pedal-de-encaixe-clip-bike-mountain-bike-wellgo-m919-preto-c-taquinhos-tipo-shimano-5439-924773056
1883,12/07,11:59,923933472,Suporte Cavalete para Manutenção de Bikes Portátil com Bandeja para Ferramentas 6575,0.0,São José dos Campos,Centro,12245680,https://sp.olx.com.br/vale-do-paraiba-e-litoral-norte/ciclismo/suporte-cavalete-para-manutencao-de-bikes-portatil-com-bandeja-para-ferramentas-6575-923933472
1884,12/07,11:54,910556925,Farol Bikes Super Led Cree T6 Bateria Recarregável 4 células Zoom e Foco Ajustável 6607,0.0,São José dos Campos,Centro,12245680,https://sp.olx.com.br/vale-do-paraiba-e-litoral-norte/ciclismo/farol-bikes-super-led-cree-t6-bateria-recarregavel-4-celulas-zoom-e-foco-ajustavel-6607-910556925
1885,12/07,07:09,1056841263,Bike 29 Oggi 7.0 2022 kit Shimano Alívio ,0.0,São Paulo,Jardim Santo Elias,05110000,https://sp.olx.com.br/sao-paulo-e-regiao/ciclismo/bike-29-oggi-7-0-2022-kit-shimano-alivio-1056841263
1886,11/07,18:17,1056711557,Bike motorizada (leia com atenção),0.0,São Paulo,Cidade São Mateus,03964020,https://sp.olx.com.br/sao-paulo-e-regiao/ciclismo/bike-motorizada-leia-com-atencao-1056711557
1887,11/07,17:02,1036273478,Bike fixa Vicini,0.0,Jacareí,Parque Santo Antônio,12309660,https://sp.olx.com.br/vale-do-paraiba-e-litoral-norte/ciclismo/bike-fixa-vicini-1036273478
1888,,,,,,,,,
1889,11/07,14:37,1056609131,Caloi 15 1979,0.0,Santos,Embaré,11040240,https://sp.olx.com.br/baixada-santista-e-litoral-sul/ciclismo/caloi-15-1979-1056609131
1890,09/07,19:39,1056056431,Bicicleta Speed Soul Expresso Fixa - TAM 51,0.0,Indaiatuba,Vila Todos os Santos,13330615,https://sp.olx.com.br/grande-campinas/ciclismo/bicicleta-speed-soul-expresso-fixa-tam-51-1056056431
1891,08/07,17:16,1055586489,BIKE FIXA / CALOI 10 FIXA + BRINDES,0.0,Guarulhos,Centro,07012031,https://sp.olx.com.br/sao-paulo-e-regiao/ciclismo/bike-fixa-caloi-10-fixa-brindes-1055586489
1892,08/07,11:41,1055424205,Rolo de Treinamento Absolute,0.0,São Paulo,Santo Amaro,04743030,https://sp.olx.com.br/sao-paulo-e-regiao/ciclismo/rolo-de-treinamento-absolute-1055424205
1893,08/07,09:51,1055354695,Bicicleta aro 29 Oggi Big Wheel 7.0 2022 kit shimano Alívio ,0.0,São Paulo,Parque Anhangüera (São Domingos),05158000,https://sp.olx.com.br/sao-paulo-e-regiao/ciclismo/bicicleta-aro-29-oggi-big-wheel-7-0-2022-kit-shimano-alivio-1055354695
1894,07/07,19:02,1046325389,Bike aro 26,0.0,Praia Grande,Vila Sônia,11722190,https://sp.olx.com.br/baixada-santista-e-litoral-sul/ciclismo/bike-aro-26-1046325389
1895,07/07,15:02,1033556315,Caloi 10 retrô hibrida fixa,0.0,Taubaté,Chácaras Cataguá,12093420,https://sp.olx.com.br/vale-do-paraiba-e-litoral-norte/ciclismo/caloi-10-retro-hibrida-fixa-1033556315
1896,06/07,15:31,1034329232,BIKE LIMOUSINE DUPLA PROTÓTIPO 001,0.0,Santos,Aparecida,11025201,https://sp.olx.com.br/baixada-santista-e-litoral-sul/ciclismo/bike-limousine-dupla-prototipo-001-1034329232
1897,06/07,13:01,1034215399,Bike fixa vicinitech personalizada.,0.0,Pindamonhangaba,Residencial Mombaça I,12425120,https://sp.olx.com.br/vale-do-paraiba-e-litoral-norte/ciclismo/bike-fixa-vicinitech-personalizada-1034215399
1898,06/07,12:16,1034273872,Aro 20 Bike ( na caixa) PROMOÇÃO ,0.0,São Paulo,Jardim São Paulo(Zona Norte),02040000,https://sp.olx.com.br/sao-paulo-e-regiao/ciclismo/aro-20-bike-na-caixa-promocao-1034273872
1899,06/07,12:16,1045665586, Kit Farol E Lanterna Bicicleta Bike Ultra Led A Prova D'água usb Recarregável,0.0,Ribeirão Preto,Ipiranga,14055080,https://sp.olx.com.br/regiao-de-ribeirao-preto/ciclismo/kit-farol-e-lanterna-bicicleta-bike-ultra-led-a-prova-d-agua-usb-recarregavel-1045665586
1900,06/07,10:42,1054434118,Caloi SS3 1976,0.0,Santos,Embaré,11040240,https://sp.olx.com.br/baixada-santista-e-litoral-sul/ciclismo/caloi-ss3-1976-1054434118
1901,06/07,10:21,1054425706,Caloi Peri 1979,0.0,Santos,Embaré,11040240,https://sp.olx.com.br/baixada-santista-e-litoral-sul/ciclismo/caloi-peri-1979-1054425706
1902,06/07,09:00,1054391334,Cadeirinha Kid Bike Preta Semi-Nova,0.0,Taubaté,Jardim Califórnia,12062150,https://sp.olx.com.br/vale-do-paraiba-e-litoral-norte/ciclismo/cadeirinha-kid-bike-preta-semi-nova-1054391334
1903,05/07,21:32,1045541025,coroa aluminio 39 dentes BCD 110 ,0.0,São Bernardo do Campo,Rudge Ramos,09631040,https://sp.olx.com.br/sao-paulo-e-regiao/ciclismo/coroa-aluminio-39-dentes-bcd-110-1045541025
1904,01/08,20:01,1063195801,Bicicleta Caloi Sprint 20,0.0,Mogi das Cruzes,Conjunto Residencial Cocuera,08793030,https://sp.olx.com.br/sao-paulo-e-regiao/ciclismo/bicicleta-caloi-sprint-20-1063195801
1905,01/08,19:31,1059011248,Speed Caloi Sprint ,0.0,Presidente Prudente,Jardim Vila Real,19063360,https://sp.olx.com.br/regiao-de-presidente-prudente/ciclismo/speed-caloi-sprint-1059011248
1906,,,,,,,,,
1907,01/08,19:01,1046177002,"Caloi Sprint 10 tamanho 54, STI Shimano ",0.0,São Paulo,Jardim Orly,04434200,https://sp.olx.com.br/sao-paulo-e-regiao/ciclismo/caloi-sprint-10-tamanho-54-sti-shimano-1046177002
1908,01/08,17:01,1065624016,Gt Sprint nova ,0.0,Jales,Jardim Paraíso,15700614,https://sp.olx.com.br/regiao-de-sao-jose-do-rio-preto/ciclismo/gt-sprint-nova-1065624016
1909,01/08,16:32,1063017346,Quadro caloi isprirt ,0.0,Indaiatuba,Jardim Juliana,13340480,https://sp.olx.com.br/grande-campinas/ciclismo/quadro-caloi-isprirt-1063017346
1910,01/08,15:44,1065578178,Caloi Speed Sprint muito conservada,0.0,Osasco,Vila Yolanda,06126120,https://sp.olx.com.br/sao-paulo-e-regiao/ciclismo/caloi-speed-sprint-muito-conservada-1065578178
1911,01/08,15:02,1063924980,Bicicleta Speed 16V 2x8 Tam 54 Venzo Sprint R3,0.0,Santo André,Jardim Santa Cristina,09171510,https://sp.olx.com.br/sao-paulo-e-regiao/ciclismo/bicicleta-speed-16v-2x8-tam-54-venzo-sprint-r3-1063924980
1912,01/08,14:25,1065537209,Caloi Sprint 20 ,0.0,Santo André,Vila América,09110320,https://sp.olx.com.br/sao-paulo-e-regiao/ciclismo/caloi-sprint-20-1065537209
1913,,,,,,,,,
1914,01/08,13:31,1058346484,Caloi Sprint M com Upgrade SORA e Garfo Carbono,0.0,São Paulo,Itaquera,08295330,https://sp.olx.com.br/sao-paulo-e-regiao/ciclismo/caloi-sprint-m-com-upgrade-sora-e-garfo-carbono-1058346484
1915,01/08,11:50,1065461390,Bicicleta Caloi Sprint ,0.0,Ribeirão Preto,Ipiranga,14060020,https://sp.olx.com.br/regiao-de-ribeirao-preto/ciclismo/bicicleta-caloi-sprint-1065461390
1916,01/08,09:40,1065392810,Vendo bike caloi Sprint muito conservada,0.0,São José do Rio Preto,Cidade Nova,15085310,https://sp.olx.com.br/regiao-de-sao-jose-do-rio-preto/ciclismo/vendo-bike-caloi-sprint-muito-conservada-1065392810
1917,31/07,22:01,1057080997,Bicicleta,0.0,Taubaté,Cidade Jardim,12091830,https://sp.olx.com.br/vale-do-paraiba-e-litoral-norte/ciclismo/bicicleta-1057080997
1918,31/07,21:32,1056656072,Caloi 10 Sprint 1984 Dourada,0.0,São Paulo,Vila Mascote,04363070,https://sp.olx.com.br/sao-paulo-e-regiao/ciclismo/caloi-10-sprint-1984-dourada-1056656072
1919,31/07,21:01,1064383196,Caloi Sprint 20 Grupo Tiagra - Excelente estado,0.0,Santos,Boqueirão,11045002,https://sp.olx.com.br/baixada-santista-e-litoral-sul/ciclismo/caloi-sprint-20-grupo-tiagra-excelente-estado-1064383196
1920,31/07,18:31,1059412366,"Bike Caloi,modelo sprint 10,2010",0.0,São Paulo,União de Vila Nova,08072000,https://sp.olx.com.br/sao-paulo-e-regiao/ciclismo/bike-caloi-modelo-sprint-10-2010-1059412366
1921,31/07,16:02,1064447118,Sprint ,0.0,Praia Grande,Samambaia,11712490,https://sp.olx.com.br/baixada-santista-e-litoral-sul/ciclismo/sprint-1064447118
1922,,,,,,,,,
1923,31/07,16:01,1064349975,Sense Rock 24v Grupo Altus C/NF - Impecável ,0.0,Santos,Boqueirão,11045002,https://sp.olx.com.br/baixada-santista-e-litoral-sul/ciclismo/sense-rock-24v-grupo-altus-c-nf-impecavel-1064349975
1924,31/07,15:31,1059788430,Bicicleta - semi nova ,0.0,São Paulo,Vila Santo Antônio,04811080,https://sp.olx.com.br/sao-paulo-e-regiao/ciclismo/bicicleta-semi-nova-1059788430
1925,31/07,14:01,1063671220,Mochila de hidratação + dois cinto de hidratação ,0.0,São Paulo,Jardim Nordeste,03688040,https://sp.olx.com.br/sao-paulo-e-regiao/ciclismo/mochila-de-hidratacao-dois-cinto-de-hidratacao-1063671220
1926,31/07,12:21,1065143557,Ksw aro 29 grupo Shimano ,0.0,São Paulo,Jardim Donária,02990330,https://sp.olx.com.br/sao-paulo-e-regiao/ciclismo/ksw-aro-29-grupo-shimano-1065143557
1927,30/07,19:13,1064995674,bike speed venzo,0.0,Pirassununga,Jardim Ferrarezzi,13636148,https://sp.olx.com.br/grande-campinas/ciclismo/bike-speed-venzo-1064995674
1928,30/07,17:44,1064971787,Bicicleta antiga,0.0,Sorocaba,Vila Barão,18061210,https://sp.olx.com.br/regiao-de-sorocaba/ciclismo/bicicleta-antiga-1064971787
1929,,,,,,,,,
1930,29/07,13:36,1044297709,Bicicleta Speed Caloi Sprint,0.0,São Paulo,Jurubatuba,04696000,https://sp.olx.com.br/sao-paulo-e-regiao/ciclismo/bicicleta-speed-caloi-sprint-1044297709
1931,29/07,12:21,1064405532,Caloi 10 sprint bicicleta aceito trocas,0.0,São Paulo,Cidade Tiradentes,08471190,https://sp.olx.com.br/sao-paulo-e-regiao/ciclismo/caloi-10-sprint-bicicleta-aceito-trocas-1064405532
1932,29/07,10:55,1064357257,Bicicleta Aro 29 GT Sprint MX1 Alumínio Freio a Disco e Suspensão - Azul+Rosa<br><br>,0.0,Águas de Lindóia,undef,13940000,https://sp.olx.com.br/grande-campinas/ciclismo/bicicleta-aro-29-gt-sprint-mx1-aluminio-freio-a-disco-e-suspensao-azul-rosa-br-br-1064357257
1933,28/07,23:22,1064220525,Caloi 10: Sprint,0.0,São Paulo,Vila Buarque,01221001,https://sp.olx.com.br/sao-paulo-e-regiao/ciclismo/caloi-10-sprint-1064220525
1934,28/07,18:44,1064127425,Caloi Sprint 10 Vintage ,0.0,Taubaté,Centro,12022696,https://sp.olx.com.br/vale-do-paraiba-e-litoral-norte/ciclismo/caloi-sprint-10-vintage-1064127425
1935,28/07,16:01,1055686027,Caloi Sprint tamanho 56,0.0,Santo André,Vila Homero Thon,09111000,https://sp.olx.com.br/sao-paulo-e-regiao/ciclismo/caloi-sprint-tamanho-56-1055686027
1936,27/07,18:27,1063625141,Bicicleta Speed Caloi Strada Top!,0.0,São Paulo,Centro,01010100,https://sp.olx.com.br/sao-paulo-e-regiao/ciclismo/bicicleta-speed-caloi-strada-top-1063625141
1937,,,,,,,,,
1938,27/07,08:52,1063349841,Bike Speed Road Shimano 12x SEM JUROS,0.0,Suzano,Parque Buenos Aires,08640860,https://sp.olx.com.br/sao-paulo-e-regiao/ciclismo/bike-speed-road-shimano-12x-sem-juros-1063349841
1939,26/07,22:47,1028618113,"Mochila Hidratação 3,7 L P/ Ciclismo Corrida Bolsa Água Bike",0.0,Santos,Vila Mathias,11075320,https://sp.olx.com.br/baixada-santista-e-litoral-sul/ciclismo/mochila-hidratacao-3-7-l-p-ciclismo-corrida-bolsa-agua-bike-1028618113
1940,26/07,19:01,1042499027,Bike speed caloi sprint,0.0,São Bernardo do Campo,Centro,09726090,https://sp.olx.com.br/sao-paulo-e-regiao/ciclismo/bike-speed-caloi-sprint-1042499027
1941,26/07,18:32,1054442297,Bicicleta GT Sprint aro 29 nunca usada!,0.0,São José dos Campos,Jardim Satélite,12230000,https://sp.olx.com.br/vale-do-paraiba-e-litoral-norte/ciclismo/bicicleta-gt-sprint-aro-29-nunca-usada-1054442297
