,dayPost,timePost,codeAd,nameBike,valueBike,city,neighborhood,cep,urlBike
0,27/07,09:02,1063357747,Guidão Mesa Passador Manete Speed Caloi10,0.0,Suzano,Parque Buenos Aires,08640860,https://sp.olx.com.br/sao-paulo-e-regiao/ciclismo/guidao-mesa-passador-manete-speed-caloi10-1063357747
1,26/07,23:11,1026724308,Gancho De Parede Suporte Para Bike Bicicleta Com Apoio Atrio bucha e parafuso ,0.0,Santos,Vila Mathias,11075320,https://sp.olx.com.br/baixada-santista-e-litoral-sul/ciclismo/gancho-de-parede-suporte-para-bike-bicicleta-com-apoio-atrio-bucha-e-parafuso-1026724308
2,,,,,,,,,
3,26/07,22:13,1063262838,Suporte fixo  para treino de bike com suporte para Pneu e Placa de step ,0.0,São José dos Campos,Residencial Dom Bosco,12225880,https://sp.olx.com.br/vale-do-paraiba-e-litoral-norte/ciclismo/suporte-fixo-para-treino-de-bike-com-suporte-para-pneu-e-placa-de-step-1063262838
4,26/07,16:28,1063129915,Cadeirinha Bike Bobike Exclusive Tour Fixa Quadro Traseira,0.0,Sertãozinho,Centro,14160160,https://sp.olx.com.br/regiao-de-ribeirao-preto/ciclismo/cadeirinha-bike-bobike-exclusive-tour-fixa-quadro-traseira-1063129915
5,26/07,14:27,1063070001,Suspensão Bike,0.0,Campinas,Vila Joaquim Inácio,13045685,https://sp.olx.com.br/grande-campinas/ciclismo/suspensao-bike-1063070001
6,25/07,11:00,1062476650,suporte para bike,0.0,Santo André,Parque Capuava,09271120,https://sp.olx.com.br/sao-paulo-e-regiao/ciclismo/suporte-para-bike-1062476650
7,24/07,18:02,1062287225,Bicicleta DRB para BMX,0.0,São Bernardo do Campo,Jardim do Mar,09726260,https://sp.olx.com.br/sao-paulo-e-regiao/ciclismo/bicicleta-drb-para-bmx-1062287225
8,23/07,16:43,1059403073,Bike urbana Airwalk City 700 vintage,0.0,Pompéia,undef,17580053,https://sp.olx.com.br/regiao-de-bauru-e-marilia/ciclismo/bike-urbana-airwalk-city-700-vintage-1059403073
9,,,,,,,,,
10,23/07,13:39,1061974104, Rack Bike Ventosa Suporte Bicicleta Rockbros 3 Bikes,0.0,Campinas,Swiss Park,13049250,https://sp.olx.com.br/grande-campinas/ciclismo/rack-bike-ventosa-suporte-bicicleta-rockbros-3-bikes-1061974104
11,22/07,21:03,1061702548,Bicicleta MTB Aro 29,0.0,São José dos Campos,Jardim Esplanada II,12242700,https://sp.olx.com.br/vale-do-paraiba-e-litoral-norte/ciclismo/bicicleta-mtb-aro-29-1061702548
12,22/07,19:37,1061660136,Peugeot 10 1977,0.0,Santos,Aparecida,11025250,https://sp.olx.com.br/baixada-santista-e-litoral-sul/ciclismo/peugeot-10-1977-1061660136
13,22/07,19:31,1041286002,Transbike Gtsm1 Force Para 2 Bicicletas Aço,0.0,São Carlos,Jardim Embaré,13563841,https://sp.olx.com.br/regiao-de-ribeirao-preto/ciclismo/transbike-gtsm1-force-para-2-bicicletas-aco-1041286002
14,22/07,16:32,1061578254,Cruiser montana,0.0,Hortolândia,Jardim Nova Hortolândia II,13183600,https://sp.olx.com.br/grande-campinas/ciclismo/cruiser-montana-1061578254
15,22/07,12:12,988575563,Bicicleta MTB Sense One 21v 2021/2022,0.0,São Paulo,Indianópolis,04062003,https://sp.olx.com.br/sao-paulo-e-regiao/ciclismo/bicicleta-mtb-sense-one-21v-2021-2022-988575563
16,22/07,12:11,977650038,Bicicleta Mtb Audax Adx LT 12v 2021 - Nova na caixa c/ Seguro,0.0,São Paulo,Indianópolis,04062003,https://sp.olx.com.br/sao-paulo-e-regiao/ciclismo/bicicleta-mtb-audax-adx-lt-12v-2021-nova-na-caixa-c-seguro-977650038
17,22/07,12:11,976914258,Bicicleta MTB Audax Auge 700 Carbon 12v 2021 - Nova na caixa c/ Seguro,0.0,São Paulo,Indianópolis,04062003,https://sp.olx.com.br/sao-paulo-e-regiao/ciclismo/bicicleta-mtb-audax-auge-700-carbon-12v-2021-nova-na-caixa-c-seguro-976914258
18,,,,,,,,,
19,22/07,10:54,1061408842,Bike fixa standart,0.0,São Paulo,Bom Retiro,01126020,https://sp.olx.com.br/sao-paulo-e-regiao/ciclismo/bike-fixa-standart-1061408842
20,22/07,10:14,1061394812,Suporte para bicicletas ,0.0,Campinas,Vila Mimosa,13050068,https://sp.olx.com.br/grande-campinas/ciclismo/suporte-para-bicicletas-1061394812
21,20/07,17:00,1060664929,Rolo De Treino Ciclismo Absolute Wild 5 Fixo Magnético Pro,0.0,São Paulo,Jardim Íris,05145000,https://sp.olx.com.br/sao-paulo-e-regiao/ciclismo/rolo-de-treino-ciclismo-absolute-wild-5-fixo-magnetico-pro-1060664929
22,20/07,13:31,1032297427,Bicicleta MTB Caloi Explorer Comp 18v 2021 Q3 - Nova na caixa,0.0,São Paulo,Indianópolis,04062003,https://sp.olx.com.br/sao-paulo-e-regiao/ciclismo/bicicleta-mtb-caloi-explorer-comp-18v-2021-q3-nova-na-caixa-1032297427
23,20/07,12:10,1060525528,Bike aro 26,0.0,São Vicente,Parque Bitaru,11330100,https://sp.olx.com.br/baixada-santista-e-litoral-sul/ciclismo/bike-aro-26-1060525528
24,18/07,20:31,1051154005,Transbike teto c/ ventosas p/ bike Carbon duplo Pace ,0.0,São Paulo,Parque Paineiras,03694000,https://sp.olx.com.br/sao-paulo-e-regiao/ciclismo/transbike-teto-c-ventosas-p-bike-carbon-duplo-pace-1051154005
25,,,,,,,,,
26,18/07,19:27,1059772640,Bike fixa Caloi 10 ano 1979,0.0,São Paulo,Americanópolis,04429030,https://sp.olx.com.br/sao-paulo-e-regiao/ciclismo/bike-fixa-caloi-10-ano-1979-1059772640
27,18/07,18:49,1059737697,Bike fixa Caloi 10 ano 1979,0.0,São Paulo,Americanópolis,04429030,https://sp.olx.com.br/sao-paulo-e-regiao/ciclismo/bike-fixa-caloi-10-ano-1979-1059737697
28,17/07,21:40,1059473475,Bike 29 Oggi Big Wheel 7.0 2022 kit Shimano Alívio 1 ano de Seguro Grátis ,0.0,São Paulo,Jardim Santo Elias,05110000,https://sp.olx.com.br/sao-paulo-e-regiao/ciclismo/bike-29-oggi-big-wheel-7-0-2022-kit-shimano-alivio-1-ano-de-seguro-gratis-1059473475
29,17/07,19:03,1059440466,Bike Speed Oggi velloce Disc 700 kit Shimano Claris Nova Tam 52/54/56,0.0,São Paulo,Jardim Líbano,05138200,https://sp.olx.com.br/sao-paulo-e-regiao/ciclismo/bike-speed-oggi-velloce-disc-700-kit-shimano-claris-nova-tam-52-54-56-1059440466
30,17/07,18:01,1050050274,Bicicleta bike single speed fixa 700c tam 52 freia Shimano urbana,0.0,Campinas,Vila Industrial,13035000,https://sp.olx.com.br/grande-campinas/ciclismo/bicicleta-bike-single-speed-fixa-700c-tam-52-freia-shimano-urbana-1050050274
31,17/07,13:04,1038981039,"Bicicleta Raio Saturno Azul - 29"" + Kit pedal",0.0,São Bernardo do Campo,Planalto,09895670,https://sp.olx.com.br/sao-paulo-e-regiao/ciclismo/bicicleta-raio-saturno-azul-29-kit-pedal-1038981039
32,17/07,13:00,1059345315,Rolo treino bike suporte bicicleta dobrável fixo ciclismo ,0.0,Campinas,Ponte Preta,13041620,https://sp.olx.com.br/grande-campinas/ciclismo/rolo-treino-bike-suporte-bicicleta-dobravel-fixo-ciclismo-1059345315
33,,,,,,,,,
34,16/07,19:07,1059192827,"Suporte p/ Bicicleta marca Kiussi, mod Etna - prata ( de R$ 590 por 400 ! )",0.0,São Paulo,Vila Mariana,04019000,https://sp.olx.com.br/sao-paulo-e-regiao/ciclismo/suporte-p-bicicleta-marca-kiussi-mod-etna-prata-de-r-590-por-400-1059192827
35,15/07,21:22,1058873860,BICICLETA CALOI FIORENTINA 1960,0.0,São Paulo,Vila Gomes Cardim,03319002,https://sp.olx.com.br/sao-paulo-e-regiao/ciclismo/bicicleta-caloi-fiorentina-1960-1058873860
36,15/07,19:43,1058845459,Monark 10 Single Speed,0.0,Santos,Embaré,11040240,https://sp.olx.com.br/baixada-santista-e-litoral-sul/ciclismo/monark-10-single-speed-1058845459
37,14/07,19:32,1049290578,Bike Fixa Caloi 10,0.0,Suzano,Centro,08674100,https://sp.olx.com.br/sao-paulo-e-regiao/ciclismo/bike-fixa-caloi-10-1049290578
38,14/07,14:02,1058167014,Alforje thule shield ,0.0,Taubaté,Centro,12020060,https://sp.olx.com.br/vale-do-paraiba-e-litoral-norte/ciclismo/alforje-thule-shield-1058167014
39,14/07,00:46,1057862354,Bicicleta Aro 29 ,0.0,São Paulo,Parque América,04822000,https://sp.olx.com.br/sao-paulo-e-regiao/ciclismo/bicicleta-aro-29-1057862354
40,,,,,,,,,
41,13/07,23:07,1057844881,Bike bicicleta Fixa,0.0,Sumaré,Residencial Guairá,13173524,https://sp.olx.com.br/grande-campinas/ciclismo/bike-bicicleta-fixa-1057844881
42,13/07,23:01,1037256848,Farol Bike Led com Buzina Recarregável [Vermelho]<br><br>Produto novo ,0.0,São José dos Campos,Jardim Satélite,12230730,https://sp.olx.com.br/vale-do-paraiba-e-litoral-norte/ciclismo/farol-bike-led-com-buzina-recarregavel-vermelho-br-br-produto-novo-1037256848
43,13/07,18:31,1048684518,Sinalizador Traseira de Bike USB Alto Brilho (Luz 2 Cores Vermelho/Branco) Recarregável,0.0,Presidente Prudente,Vila Tazitsu,19023000,https://sp.olx.com.br/regiao-de-presidente-prudente/ciclismo/sinalizador-traseira-de-bike-usb-alto-brilho-luz-2-cores-vermelho-branco-recarregavel-1048684518
44,13/07,16:40,940931396,Bicicleta Urbana Groove Blues MD 21v 2021 - Nova na caixa,0.0,São Paulo,Indianópolis,04062003,https://sp.olx.com.br/sao-paulo-e-regiao/ciclismo/bicicleta-urbana-groove-blues-md-21v-2021-nova-na-caixa-940931396
45,13/07,16:39,979526785,Bicicleta Urbana Groove Urban ID 21v 2021 - Nova na caixa,0.0,São Paulo,Indianópolis,04062003,https://sp.olx.com.br/sao-paulo-e-regiao/ciclismo/bicicleta-urbana-groove-urban-id-21v-2021-nova-na-caixa-979526785
46,13/07,16:33,921212986,Bicicleta Urbana Groove Cosmopolitan 7v 2021 - Nova na caixa,0.0,São Paulo,Indianópolis,04062003,https://sp.olx.com.br/sao-paulo-e-regiao/ciclismo/bicicleta-urbana-groove-cosmopolitan-7v-2021-nova-na-caixa-921212986
47,13/07,15:55,1057639296,Bicicleta de Equilíbrio Runna Bike Azul,0.0,São Paulo,Parque Panamericano,02992210,https://sp.olx.com.br/sao-paulo-e-regiao/ciclismo/bicicleta-de-equilibrio-runna-bike-azul-1057639296
48,13/07,14:29,1057599502,Bike aro 29 Tsw Stamina grupo Shimano 18v Alívio ,0.0,São Paulo,Jardim Líbano,05138200,https://sp.olx.com.br/sao-paulo-e-regiao/ciclismo/bike-aro-29-tsw-stamina-grupo-shimano-18v-alivio-1057599502
49,13/07,13:24,1028878100,Sinalizador Diant. e Tras. JWS Bicicletas Silicone Luz 2 Leds Branco e Vermelho 5363,0.0,São José dos Campos,Vila Ester,12221680,https://sp.olx.com.br/vale-do-paraiba-e-litoral-norte/ciclismo/sinalizador-diant-e-tras-jws-bicicletas-silicone-luz-2-leds-branco-e-vermelho-5363-1028878100
50,13/07,13:23,1029015574,Sinalizador com Led Jws JY-918 Recarregável USB Led Vermelho 4 Modos Super Forte 5367,0.0,São José dos Campos,Vila Ester,12221680,https://sp.olx.com.br/vale-do-paraiba-e-litoral-norte/ciclismo/sinalizador-com-led-jws-jy-918-recarregavel-usb-led-vermelho-4-modos-super-forte-5367-1029015574
51,13/07,13:22,1029485139,Farol Lanterna Bicicleta Led Cree T6 com Zoom Super Forte Bateria Externa 6 células 8391,0.0,São José dos Campos,Centro,12245680,https://sp.olx.com.br/vale-do-paraiba-e-litoral-norte/ciclismo/farol-lanterna-bicicleta-led-cree-t6-com-zoom-super-forte-bateria-externa-6-celulas-8391-1029485139
52,13/07,13:21,1028475977,Sensor De Velocidade Garmin ANT+ Para Bicicleta Ideal para uso em Rolo de Treino 8675,0.0,São José dos Campos,Centro,12245680,https://sp.olx.com.br/vale-do-paraiba-e-litoral-norte/ciclismo/sensor-de-velocidade-garmin-ant-para-bicicleta-ideal-para-uso-em-rolo-de-treino-8675-1028475977
53,13/07,13:20,1030861783,Sinalizador Led 70 Lumens Jws WS-096 Recarregável USB Led Vermelho/Branco 6 Modos 7127,0.0,São José dos Campos,Vila Ester,12221680,https://sp.olx.com.br/vale-do-paraiba-e-litoral-norte/ciclismo/sinalizador-led-70-lumens-jws-ws-096-recarregavel-usb-led-vermelho-branco-6-modos-7127-1030861783
54,13/07,13:14,1028488988,Passador Shimano Deore XT M780 I-Spec 2 e 3x10 velocidades - Usado 8862,0.0,São José dos Campos,Centro,12245680,https://sp.olx.com.br/vale-do-paraiba-e-litoral-norte/ciclismo/passador-shimano-deore-xt-m780-i-spec-2-e-3x10-velocidades-usado-8862-1028488988
55,13/07,13:08,1030404483,Rodinha Lateral para Bicicleta Infantil Aro 16 Roda de Equilíbrio 8652,0.0,São José dos Campos,Centro,12245680,https://sp.olx.com.br/vale-do-paraiba-e-litoral-norte/ciclismo/rodinha-lateral-para-bicicleta-infantil-aro-16-roda-de-equilibrio-8652-1030404483
56,13/07,13:04,1030409572,Pedal de encaixe Clip Bicicleta Mountain-Bike Shimano M520 Preto Com Taquinhos Sh-51 1277,0.0,São José dos Campos,Vila Ester,12221680,https://sp.olx.com.br/vale-do-paraiba-e-litoral-norte/ciclismo/pedal-de-encaixe-clip-bicicleta-mountain-bike-shimano-m520-preto-com-taquinhos-sh-51-1277-1030409572
57,13/07,12:34,930587776,Farol para Bikes Jws WS-112W com Super Led Cree T6 Bateria Recarregável de 6 células 7639,0.0,São José dos Campos,Centro,12245680,https://sp.olx.com.br/vale-do-paraiba-e-litoral-norte/ciclismo/farol-para-bikes-jws-ws-112w-com-super-led-cree-t6-bateria-recarregavel-de-6-celulas-7639-930587776
58,,,,,,,,,
59,13/07,12:34,926390052,Sinalizador Diant e Tras Absolute JY-267 para Bike Silicone c 2 Leds Branco Vermelho 6985,0.0,São José dos Campos,Centro,12245680,https://sp.olx.com.br/vale-do-paraiba-e-litoral-norte/ciclismo/sinalizador-diant-e-tras-absolute-jy-267-para-bike-silicone-c-2-leds-branco-vermelho-6985-926390052
60,13/07,12:27,1040308131,Pedal de encaixe Clip Bicicleta Mountain-Bike Wellgo M919 Preto (Usado) 8788,0.0,São José dos Campos,Vila Ester,12221680,https://sp.olx.com.br/vale-do-paraiba-e-litoral-norte/ciclismo/pedal-de-encaixe-clip-bicicleta-mountain-bike-wellgo-m919-preto-usado-8788-1040308131
61,13/07,12:14,926858217,Sinalizador com Led Jws Ws-207 Recarregável usb 7 Leds Vermelho Amarelo 4 Modos 7133,0.0,São José dos Campos,Centro,12245680,https://sp.olx.com.br/vale-do-paraiba-e-litoral-norte/ciclismo/sinalizador-com-led-jws-ws-207-recarregavel-usb-7-leds-vermelho-amarelo-4-modos-7133-926858217
62,13/07,11:30,1032019710,Sinalizador Epic Line XC-782 Diant. e Tras. Silicone com Led Luz Noturna de Segurança 7511,0.0,São José dos Campos,Vila Ester,12221680,https://sp.olx.com.br/vale-do-paraiba-e-litoral-norte/ciclismo/sinalizador-epic-line-xc-782-diant-e-tras-silicone-com-led-luz-noturna-de-seguranca-7511-1032019710
63,12/07,18:11,1048161260,"Bike Speed, catraca fixa também ",0.0,São Paulo,Jardim Vergueiro (Sacomã),04166003,https://sp.olx.com.br/sao-paulo-e-regiao/ciclismo/bike-speed-catraca-fixa-tambem-1048161260
64,12/07,14:43,1057042925,Caloi 10 1986 ,0.0,Santos,Embaré,11040240,https://sp.olx.com.br/baixada-santista-e-litoral-sul/ciclismo/caloi-10-1986-1057042925
65,,,,,,,,,
66,12/07,14:40,1036323055,Fita de Guidão Genesi para Bicicletas Speed Road Gravel Cor Preta em EVA Macio 8371,0.0,São José dos Campos,Vila Ester,12221680,https://sp.olx.com.br/vale-do-paraiba-e-litoral-norte/ciclismo/fita-de-guidao-genesi-para-bicicletas-speed-road-gravel-cor-preta-em-eva-macio-8371-1036323055
67,12/07,14:38,937280899,Sinalizador com Led Jws WS-211 Recarregável USB 8 Leds Pisca Vermelho 5 Super Forte 7129,0.0,São José dos Campos,Centro,12245680,https://sp.olx.com.br/vale-do-paraiba-e-litoral-norte/ciclismo/sinalizador-com-led-jws-ws-211-recarregavel-usb-8-leds-pisca-vermelho-5-super-forte-7129-937280899
68,12/07,14:37,912081167,Suporte Avançado de Bike para GPS Garmin Edge Bryton Cateye e Câmera GoPro 7157,0.0,São José dos Campos,Centro,12245680,https://sp.olx.com.br/vale-do-paraiba-e-litoral-norte/ciclismo/suporte-avancado-de-bike-para-gps-garmin-edge-bryton-cateye-e-camera-gopro-7157-912081167
69,12/07,14:12,938812027,Chave Ferramenta JWS Extrator de Movimento Central Hollowtech e Chave de Cassete 7633,0.0,São José dos Campos,Centro,12245680,https://sp.olx.com.br/vale-do-paraiba-e-litoral-norte/ciclismo/chave-ferramenta-jws-extrator-de-movimento-central-hollowtech-e-chave-de-cassete-7633-938812027
70,12/07,14:12,935767055,Sinalizador Diant e Tras Epic Line EPL-2215 Bike Luz Noturna 2 Leds Branco e Vermelho 7509,0.0,São José dos Campos,Centro,12245680,https://sp.olx.com.br/vale-do-paraiba-e-litoral-norte/ciclismo/sinalizador-diant-e-tras-epic-line-epl-2215-bike-luz-noturna-2-leds-branco-e-vermelho-7509-935767055
71,12/07,13:13,930648229,Sinalizador Diant Traseiro Vortex Bike Silicone Luz Noturna 2 Leds Branco e Vermelho 7077,0.0,São José dos Campos,Centro,12245680,https://sp.olx.com.br/vale-do-paraiba-e-litoral-norte/ciclismo/sinalizador-diant-traseiro-vortex-bike-silicone-luz-noturna-2-leds-branco-e-vermelho-7077-930648229
72,12/07,13:09,935306727,GPS Ciclocomputador para Bikes Absolute Nero Compatível com Strava 7229,0.0,São José dos Campos,Centro,12245680,https://sp.olx.com.br/vale-do-paraiba-e-litoral-norte/ciclismo/gps-ciclocomputador-para-bikes-absolute-nero-compativel-com-strava-7229-935306727
73,12/07,12:51,909433819,Ferramenta de Reparo Macarrão Para Pneu Tubeless para Bike com Agulha ArStop 3776,0.0,São José dos Campos,Centro,12245680,https://sp.olx.com.br/vale-do-paraiba-e-litoral-norte/ciclismo/ferramenta-de-reparo-macarrao-para-pneu-tubeless-para-bike-com-agulha-arstop-3776-909433819
74,,,,,,,,,
75,12/07,12:50,914853771,Chave Jws Instalação Movimento Central Hollowtech Shimano Truvativ Fsa Megaexo 7363,0.0,São José dos Campos,Centro,12245680,https://sp.olx.com.br/vale-do-paraiba-e-litoral-norte/ciclismo/chave-jws-instalacao-movimento-central-hollowtech-shimano-truvativ-fsa-megaexo-7363-914853771
76,12/07,12:45,1037281317,Sinalizador Led Jws WS-206 Recarregável USB 5 Leds Pisca Vermelho 4 Modos Super Forte 8633,0.0,São José dos Campos,Vila Ester,12221680,https://sp.olx.com.br/vale-do-paraiba-e-litoral-norte/ciclismo/sinalizador-led-jws-ws-206-recarregavel-usb-5-leds-pisca-vermelho-4-modos-super-forte-8633-1037281317
77,12/07,12:40,1037356762,Guia de Cabo de Câmbio Para Quadro de Bicicleta Speed/MTB Fixação Movimento Central 8613,0.0,São José dos Campos,Vila Ester,12221680,https://sp.olx.com.br/vale-do-paraiba-e-litoral-norte/ciclismo/guia-de-cabo-de-cambio-para-quadro-de-bicicleta-speed-mtb-fixacao-movimento-central-8613-1037356762
78,12/07,12:36,1039262172,Abraçadeira Para Passadores de Marchas Sram Trigger Shifter XX1 X01 X0 X9 X7 Eagle 5665,0.0,São José dos Campos,Vila Ester,12221680,https://sp.olx.com.br/vale-do-paraiba-e-litoral-norte/ciclismo/abracadeira-para-passadores-de-marchas-sram-trigger-shifter-xx1-x01-x0-x9-x7-eagle-5665-1039262172
79,12/07,12:36,1039262931,Adaptador De Freio À Disco Shimano IS Para Post Mount Rotor 180/160mm 6505,0.0,São José dos Campos,Vila Ester,12221680,https://sp.olx.com.br/vale-do-paraiba-e-litoral-norte/ciclismo/adaptador-de-freio-disco-shimano-is-para-post-mount-rotor-180-160mm-6505-1039262931
80,12/07,12:25,945752121,Kit Lanterna Dianteira Bike WS-205 e Sinalizador Traseiro JY-918 JWS Recarregável 7607,0.0,São José dos Campos,Centro,12245680,https://sp.olx.com.br/vale-do-paraiba-e-litoral-norte/ciclismo/kit-lanterna-dianteira-bike-ws-205-e-sinalizador-traseiro-jy-918-jws-recarregavel-7607-945752121
81,,,,,,,,,
82,12/07,12:25,931258599,Pezinho Para Bike Descanso Lateral JWS Com Regulagem Preto Aro 20 até 29 7361,0.0,São José dos Campos,Centro,12245680,https://sp.olx.com.br/vale-do-paraiba-e-litoral-norte/ciclismo/pezinho-para-bike-descanso-lateral-jws-com-regulagem-preto-aro-20-ate-29-7361-931258599
83,12/07,12:24,996207404,"Suporte de Celular Bike e Moto Fixo no Guidão com Touchscreen Prova D'agua até 6,5"" 8355",0.0,São José dos Campos,Centro,12245680,https://sp.olx.com.br/vale-do-paraiba-e-litoral-norte/ciclismo/suporte-de-celular-bike-e-moto-fixo-no-guidao-com-touchscreen-prova-d-agua-ate-6-5-8355-996207404
84,12/07,12:22,938805621,Lanterna WS-205 800 Lúmens e Sinalizador Led WS-207 Vermelho Amarelo Recarregável 7605,0.0,São José dos Campos,Centro,12245680,https://sp.olx.com.br/vale-do-paraiba-e-litoral-norte/ciclismo/lanterna-ws-205-800-lumens-e-sinalizador-led-ws-207-vermelho-amarelo-recarregavel-7605-938805621
85,12/07,12:22,931691043,Sinalizador Diant e Tras Jws JY009 Bike Silicone Luz Noturna 2 Leds Branco e Vermelho 7131,0.0,São José dos Campos,Centro,12245680,https://sp.olx.com.br/vale-do-paraiba-e-litoral-norte/ciclismo/sinalizador-diant-e-tras-jws-jy009-bike-silicone-luz-noturna-2-leds-branco-e-vermelho-7131-931691043
86,12/07,12:12,995892437,Suporte de Celular Veicular Carro Articulado com Ventosa para Painel ou Vidro 8365,0.0,São José dos Campos,Centro,12245680,https://sp.olx.com.br/vale-do-paraiba-e-litoral-norte/ciclismo/suporte-de-celular-veicular-carro-articulado-com-ventosa-para-painel-ou-vidro-8365-995892437
87,12/07,12:09,923521572,Lanterna Farol Dianteiro para Bike Jws JY-263 Super Led Preto Recarregável 5377,0.0,São José dos Campos,Centro,12245680,https://sp.olx.com.br/vale-do-paraiba-e-litoral-norte/ciclismo/lanterna-farol-dianteiro-para-bike-jws-jy-263-super-led-preto-recarregavel-5377-923521572
88,12/07,12:09,924800512,Sinalizador com Led 100 Lumens Jws WS-212 Recarregável USB Led Vermelho e Branco 5365,0.0,São José dos Campos,Centro,12245680,https://sp.olx.com.br/vale-do-paraiba-e-litoral-norte/ciclismo/sinalizador-com-led-100-lumens-jws-ws-212-recarregavel-usb-led-vermelho-e-branco-5365-924800512
89,,,,,,,,,
90,12/07,12:04,924773056,Pedal de encaixe Clip Bike Mountain-Bike Wellgo M919 Preto C/ Taquinhos tipo Shimano 5439,0.0,São José dos Campos,Centro,12245680,https://sp.olx.com.br/vale-do-paraiba-e-litoral-norte/ciclismo/pedal-de-encaixe-clip-bike-mountain-bike-wellgo-m919-preto-c-taquinhos-tipo-shimano-5439-924773056
91,12/07,11:59,923933472,Suporte Cavalete para Manutenção de Bikes Portátil com Bandeja para Ferramentas 6575,0.0,São José dos Campos,Centro,12245680,https://sp.olx.com.br/vale-do-paraiba-e-litoral-norte/ciclismo/suporte-cavalete-para-manutencao-de-bikes-portatil-com-bandeja-para-ferramentas-6575-923933472
92,12/07,11:54,910556925,Farol Bikes Super Led Cree T6 Bateria Recarregável 4 células Zoom e Foco Ajustável 6607,0.0,São José dos Campos,Centro,12245680,https://sp.olx.com.br/vale-do-paraiba-e-litoral-norte/ciclismo/farol-bikes-super-led-cree-t6-bateria-recarregavel-4-celulas-zoom-e-foco-ajustavel-6607-910556925
93,12/07,07:09,1056841263,Bike 29 Oggi 7.0 2022 kit Shimano Alívio ,0.0,São Paulo,Jardim Santo Elias,05110000,https://sp.olx.com.br/sao-paulo-e-regiao/ciclismo/bike-29-oggi-7-0-2022-kit-shimano-alivio-1056841263
94,11/07,18:17,1056711557,Bike motorizada (leia com atenção),0.0,São Paulo,Cidade São Mateus,03964020,https://sp.olx.com.br/sao-paulo-e-regiao/ciclismo/bike-motorizada-leia-com-atencao-1056711557
95,11/07,17:02,1036273478,Bike fixa Vicini,0.0,Jacareí,Parque Santo Antônio,12309660,https://sp.olx.com.br/vale-do-paraiba-e-litoral-norte/ciclismo/bike-fixa-vicini-1036273478
96,,,,,,,,,
97,11/07,14:37,1056609131,Caloi 15 1979,0.0,Santos,Embaré,11040240,https://sp.olx.com.br/baixada-santista-e-litoral-sul/ciclismo/caloi-15-1979-1056609131
98,09/07,19:39,1056056431,Bicicleta Speed Soul Expresso Fixa - TAM 51,0.0,Indaiatuba,Vila Todos os Santos,13330615,https://sp.olx.com.br/grande-campinas/ciclismo/bicicleta-speed-soul-expresso-fixa-tam-51-1056056431
99,08/07,17:16,1055586489,BIKE FIXA / CALOI 10 FIXA + BRINDES,0.0,Guarulhos,Centro,07012031,https://sp.olx.com.br/sao-paulo-e-regiao/ciclismo/bike-fixa-caloi-10-fixa-brindes-1055586489
100,08/07,11:41,1055424205,Rolo de Treinamento Absolute,0.0,São Paulo,Santo Amaro,04743030,https://sp.olx.com.br/sao-paulo-e-regiao/ciclismo/rolo-de-treinamento-absolute-1055424205
101,08/07,09:51,1055354695,Bicicleta aro 29 Oggi Big Wheel 7.0 2022 kit shimano Alívio ,0.0,São Paulo,Parque Anhangüera (São Domingos),05158000,https://sp.olx.com.br/sao-paulo-e-regiao/ciclismo/bicicleta-aro-29-oggi-big-wheel-7-0-2022-kit-shimano-alivio-1055354695
102,07/07,19:02,1046325389,Bike aro 26,0.0,Praia Grande,Vila Sônia,11722190,https://sp.olx.com.br/baixada-santista-e-litoral-sul/ciclismo/bike-aro-26-1046325389
103,07/07,15:02,1033556315,Caloi 10 retrô hibrida fixa,0.0,Taubaté,Chácaras Cataguá,12093420,https://sp.olx.com.br/vale-do-paraiba-e-litoral-norte/ciclismo/caloi-10-retro-hibrida-fixa-1033556315
104,06/07,15:31,1034329232,BIKE LIMOUSINE DUPLA PROTÓTIPO 001,0.0,Santos,Aparecida,11025201,https://sp.olx.com.br/baixada-santista-e-litoral-sul/ciclismo/bike-limousine-dupla-prototipo-001-1034329232
105,06/07,13:01,1034215399,Bike fixa vicinitech personalizada.,0.0,Pindamonhangaba,Residencial Mombaça I,12425120,https://sp.olx.com.br/vale-do-paraiba-e-litoral-norte/ciclismo/bike-fixa-vicinitech-personalizada-1034215399
106,06/07,12:16,1034273872,Aro 20 Bike ( na caixa) PROMOÇÃO ,0.0,São Paulo,Jardim São Paulo(Zona Norte),02040000,https://sp.olx.com.br/sao-paulo-e-regiao/ciclismo/aro-20-bike-na-caixa-promocao-1034273872
107,06/07,12:16,1045665586, Kit Farol E Lanterna Bicicleta Bike Ultra Led A Prova D'água usb Recarregável,0.0,Ribeirão Preto,Ipiranga,14055080,https://sp.olx.com.br/regiao-de-ribeirao-preto/ciclismo/kit-farol-e-lanterna-bicicleta-bike-ultra-led-a-prova-d-agua-usb-recarregavel-1045665586
108,06/07,10:42,1054434118,Caloi SS3 1976,0.0,Santos,Embaré,11040240,https://sp.olx.com.br/baixada-santista-e-litoral-sul/ciclismo/caloi-ss3-1976-1054434118
109,06/07,10:21,1054425706,Caloi Peri 1979,0.0,Santos,Embaré,11040240,https://sp.olx.com.br/baixada-santista-e-litoral-sul/ciclismo/caloi-peri-1979-1054425706
110,06/07,09:00,1054391334,Cadeirinha Kid Bike Preta Semi-Nova,0.0,Taubaté,Jardim Califórnia,12062150,https://sp.olx.com.br/vale-do-paraiba-e-litoral-norte/ciclismo/cadeirinha-kid-bike-preta-semi-nova-1054391334
111,05/07,21:32,1045541025,coroa aluminio 39 dentes BCD 110 ,0.0,São Bernardo do Campo,Rudge Ramos,09631040,https://sp.olx.com.br/sao-paulo-e-regiao/ciclismo/coroa-aluminio-39-dentes-bcd-110-1045541025
112,27/07,09:02,1063357747,Guidão Mesa Passador Manete Speed Caloi10,0.0,Suzano,Parque Buenos Aires,08640860,https://sp.olx.com.br/sao-paulo-e-regiao/ciclismo/guidao-mesa-passador-manete-speed-caloi10-1063357747
113,26/07,23:11,1026724308,Gancho De Parede Suporte Para Bike Bicicleta Com Apoio Atrio bucha e parafuso ,0.0,Santos,Vila Mathias,11075320,https://sp.olx.com.br/baixada-santista-e-litoral-sul/ciclismo/gancho-de-parede-suporte-para-bike-bicicleta-com-apoio-atrio-bucha-e-parafuso-1026724308
114,,,,,,,,,
115,26/07,22:13,1063262838,Suporte fixo  para treino de bike com suporte para Pneu e Placa de step ,0.0,São José dos Campos,Residencial Dom Bosco,12225880,https://sp.olx.com.br/vale-do-paraiba-e-litoral-norte/ciclismo/suporte-fixo-para-treino-de-bike-com-suporte-para-pneu-e-placa-de-step-1063262838
