,dayPost,timePost,codeAd,nameBike,valueBike,city,neighborhood,cep,urlBike
2479,17/07,13:00,1059345315,Rolo treino bike suporte bicicleta dobrável fixo ciclismo ,0.0,Campinas,Ponte Preta,13041620,https://sp.olx.com.br/grande-campinas/ciclismo/rolo-treino-bike-suporte-bicicleta-dobravel-fixo-ciclismo-1059345315
2480,17/07,10:00,1059297327,bike aro 29 south,1100.0,Mogi das Cruzes,Vila Vitória,08730480,https://sp.olx.com.br/sao-paulo-e-regiao/ciclismo/bike-aro-29-south-1059297327
2481,16/07,22:02,1057016098,Bike fixa/single,2500.0,Registro,undef,11900000,https://sp.olx.com.br/baixada-santista-e-litoral-sul/ciclismo/bike-fixa-single-1057016098
2482,,,,,,,,,
2483,16/07,19:07,1059192827,"Suporte p/ Bicicleta marca Kiussi, mod Etna - prata ( de R$ 590 por 400 ! )",400.0,São Paulo,Vila Mariana,04019000,https://sp.olx.com.br/sao-paulo-e-regiao/ciclismo/suporte-p-bicicleta-marca-kiussi-mod-etna-prata-de-r-590-por-400-1059192827
2484,16/07,19:01,1051154005,Transbike teto c/ ventosas p/ bike Carbon duplo Pace ,300.0,São Paulo,Parque Paineiras,03694000,https://sp.olx.com.br/sao-paulo-e-regiao/ciclismo/transbike-teto-c-ventosas-p-bike-carbon-duplo-pace-1051154005
2485,16/07,18:01,1053684962,Bike Fixa Raf,1800.0,Sorocaba,Vila Jardini,18044110,https://sp.olx.com.br/regiao-de-sorocaba/ciclismo/bike-fixa-raf-1053684962
2486,16/07,18:01,1058146608,Bicicleta GTA Aro 29 Mountain Bike ,1000.0,São José dos Campos,Cidade Morumbi,12236660,https://sp.olx.com.br/vale-do-paraiba-e-litoral-norte/ciclismo/bicicleta-gta-aro-29-mountain-bike-1058146608
2487,16/07,17:32,1056307180,Trek 7100 aro 29,3500.0,São Paulo,Vila da Saúde,04145020,https://sp.olx.com.br/sao-paulo-e-regiao/ciclismo/trek-7100-aro-29-1056307180
2488,16/07,16:01,1038009764,Bicicleta Caloi aluminum 100 c cadeirinha,670.0,São Paulo,Indianópolis,04080000,https://sp.olx.com.br/sao-paulo-e-regiao/ciclismo/bicicleta-caloi-aluminum-100-c-cadeirinha-1038009764
2489,,,,,,,,,
2490,15/07,21:22,1058873860,BICICLETA CALOI FIORENTINA 1960,1500.0,São Paulo,Vila Gomes Cardim,03319002,https://sp.olx.com.br/sao-paulo-e-regiao/ciclismo/bicicleta-caloi-fiorentina-1960-1058873860
2491,15/07,19:43,1058845459,Monark 10 Single Speed,1000.0,Santos,Embaré,11040240,https://sp.olx.com.br/baixada-santista-e-litoral-sul/ciclismo/monark-10-single-speed-1058845459
2492,14/07,20:37,1058336934,Bike Fixa - Fixed Gear Raf Bikes tamanho 58,2000.0,São Paulo,Vila Clementino,04044060,https://sp.olx.com.br/sao-paulo-e-regiao/ciclismo/bike-fixa-fixed-gear-raf-bikes-tamanho-58-1058336934
2493,14/07,19:32,1049290578,Bike Fixa Caloi 10,2500.0,Suzano,Centro,08674100,https://sp.olx.com.br/sao-paulo-e-regiao/ciclismo/bike-fixa-caloi-10-1049290578
2494,14/07,14:02,1058167014,Alforje thule shield ,1900.0,Taubaté,Centro,12020060,https://sp.olx.com.br/vale-do-paraiba-e-litoral-norte/ciclismo/alforje-thule-shield-1058167014
2495,14/07,00:46,1057862354,Bicicleta Aro 29 ,3400.0,São Paulo,Parque América,04822000,https://sp.olx.com.br/sao-paulo-e-regiao/ciclismo/bicicleta-aro-29-1057862354
2496,13/07,23:07,1057844881,Bike bicicleta Fixa,1100.0,Sumaré,Residencial Guairá,13173524,https://sp.olx.com.br/grande-campinas/ciclismo/bike-bicicleta-fixa-1057844881
2497,,,,,,,,,
2498,13/07,23:01,1037256848,Farol Bike Led com Buzina Recarregável [Vermelho]<br><br>Produto novo ,59.0,São José dos Campos,Jardim Satélite,12230730,https://sp.olx.com.br/vale-do-paraiba-e-litoral-norte/ciclismo/farol-bike-led-com-buzina-recarregavel-vermelho-br-br-produto-novo-1037256848
2499,13/07,18:31,1048684518,Sinalizador Traseira de Bike USB Alto Brilho (Luz 2 Cores Vermelho/Branco) Recarregável,45.0,Presidente Prudente,Vila Tazitsu,19023000,https://sp.olx.com.br/regiao-de-presidente-prudente/ciclismo/sinalizador-traseira-de-bike-usb-alto-brilho-luz-2-cores-vermelho-branco-recarregavel-1048684518
2500,13/07,17:09,1057681162,Aro 29,850.0,São Caetano do Sul,Santa Maria,09560500,https://sp.olx.com.br/sao-paulo-e-regiao/ciclismo/aro-29-1057681162
2501,13/07,16:40,940931396,Bicicleta Urbana Groove Blues MD 21v 2021 - Nova na caixa,2999.0,São Paulo,Indianópolis,04062003,https://sp.olx.com.br/sao-paulo-e-regiao/ciclismo/bicicleta-urbana-groove-blues-md-21v-2021-nova-na-caixa-940931396
2502,13/07,16:39,979526785,Bicicleta Urbana Groove Urban ID 21v 2021,2999.0,São Paulo,Indianópolis,04062003,https://sp.olx.com.br/sao-paulo-e-regiao/ciclismo/bicicleta-urbana-groove-urban-id-21v-2021-979526785
2503,13/07,16:33,921212986,Bicicleta Urbana Groove Cosmopolitan 7v 2021 - Nova na caixa,2199.0,São Paulo,Indianópolis,04062003,https://sp.olx.com.br/sao-paulo-e-regiao/ciclismo/bicicleta-urbana-groove-cosmopolitan-7v-2021-nova-na-caixa-921212986
2504,,,,,,,,,
2505,13/07,15:55,1057639296,Bicicleta de Equilíbrio Runna Bike Azul,250.0,São Paulo,Parque Panamericano,02992210,https://sp.olx.com.br/sao-paulo-e-regiao/ciclismo/bicicleta-de-equilibrio-runna-bike-azul-1057639296
2506,13/07,15:12,1057622595,Bike fixa caloi 10,800.0,São Paulo,Vila Mariana,04012001,https://sp.olx.com.br/sao-paulo-e-regiao/ciclismo/bike-fixa-caloi-10-1057622595
2507,13/07,14:29,1057599502,Bike aro 29 Tsw Stamina grupo Shimano 18v Alívio ,4149.0,São Paulo,Jardim Líbano,05138200,https://sp.olx.com.br/sao-paulo-e-regiao/ciclismo/bike-aro-29-tsw-stamina-grupo-shimano-18v-alivio-1057599502
2508,13/07,13:24,1028878100,Sinalizador Diant. e Tras. JWS Bicicletas Silicone Luz 2 Leds Branco e Vermelho 5363,16.0,São José dos Campos,Vila Ester,12221680,https://sp.olx.com.br/vale-do-paraiba-e-litoral-norte/ciclismo/sinalizador-diant-e-tras-jws-bicicletas-silicone-luz-2-leds-branco-e-vermelho-5363-1028878100
2509,13/07,13:23,1029015574,Sinalizador com Led Jws JY-918 Recarregável USB Led Vermelho 4 Modos Super Forte 5367,18.0,São José dos Campos,Vila Ester,12221680,https://sp.olx.com.br/vale-do-paraiba-e-litoral-norte/ciclismo/sinalizador-com-led-jws-jy-918-recarregavel-usb-led-vermelho-4-modos-super-forte-5367-1029015574
2510,13/07,13:22,1029485139,Farol Lanterna Bicicleta Led Cree T6 com Zoom Super Forte Bateria Externa 6 células 8391,81.0,São José dos Campos,Centro,12245680,https://sp.olx.com.br/vale-do-paraiba-e-litoral-norte/ciclismo/farol-lanterna-bicicleta-led-cree-t6-com-zoom-super-forte-bateria-externa-6-celulas-8391-1029485139
2511,13/07,13:21,1028475977,Sensor De Velocidade Garmin ANT+ Para Bicicleta Ideal para uso em Rolo de Treino 8675,150.0,São José dos Campos,Centro,12245680,https://sp.olx.com.br/vale-do-paraiba-e-litoral-norte/ciclismo/sensor-de-velocidade-garmin-ant-para-bicicleta-ideal-para-uso-em-rolo-de-treino-8675-1028475977
2512,13/07,13:20,1030861783,Sinalizador Led 70 Lumens Jws WS-096 Recarregável USB Led Vermelho/Branco 6 Modos 7127,49.0,São José dos Campos,Vila Ester,12221680,https://sp.olx.com.br/vale-do-paraiba-e-litoral-norte/ciclismo/sinalizador-led-70-lumens-jws-ws-096-recarregavel-usb-led-vermelho-branco-6-modos-7127-1030861783
2513,13/07,13:14,1028488988,Passador Shimano Deore XT M780 I-Spec 2 e 3x10 velocidades - Usado 8862,396.0,São José dos Campos,Centro,12245680,https://sp.olx.com.br/vale-do-paraiba-e-litoral-norte/ciclismo/passador-shimano-deore-xt-m780-i-spec-2-e-3x10-velocidades-usado-8862-1028488988
2514,13/07,13:08,1030404483,Rodinha Lateral para Bicicleta Infantil Aro 16 Roda de Equilíbrio 8652,21.0,São José dos Campos,Centro,12245680,https://sp.olx.com.br/vale-do-paraiba-e-litoral-norte/ciclismo/rodinha-lateral-para-bicicleta-infantil-aro-16-roda-de-equilibrio-8652-1030404483
2515,13/07,13:04,1030409572,Pedal de encaixe Clip Bicicleta Mountain-Bike Shimano M520 Preto Com Taquinhos Sh-51 1277,405.0,São José dos Campos,Vila Ester,12221680,https://sp.olx.com.br/vale-do-paraiba-e-litoral-norte/ciclismo/pedal-de-encaixe-clip-bicicleta-mountain-bike-shimano-m520-preto-com-taquinhos-sh-51-1277-1030409572
2516,13/07,12:34,930587776,Farol para Bikes Jws WS-112W com Super Led Cree T6 Bateria Recarregável de 6 células 7639,125.0,São José dos Campos,Centro,12245680,https://sp.olx.com.br/vale-do-paraiba-e-litoral-norte/ciclismo/farol-para-bikes-jws-ws-112w-com-super-led-cree-t6-bateria-recarregavel-de-6-celulas-7639-930587776
2517,13/07,12:34,926390052,Sinalizador Diant e Tras Absolute JY-267 para Bike Silicone c 2 Leds Branco Vermelho 6985,23.0,São José dos Campos,Centro,12245680,https://sp.olx.com.br/vale-do-paraiba-e-litoral-norte/ciclismo/sinalizador-diant-e-tras-absolute-jy-267-para-bike-silicone-c-2-leds-branco-vermelho-6985-926390052
2518,13/07,12:27,1040308131,Pedal de encaixe Clip Bicicleta Mountain-Bike Wellgo M919 Preto (Usado) 8788,171.0,São José dos Campos,Vila Ester,12221680,https://sp.olx.com.br/vale-do-paraiba-e-litoral-norte/ciclismo/pedal-de-encaixe-clip-bicicleta-mountain-bike-wellgo-m919-preto-usado-8788-1040308131
2519,13/07,12:14,926858217,Sinalizador com Led Jws Ws-207 Recarregável usb 7 Leds Vermelho Amarelo 4 Modos 7133,26.0,São José dos Campos,Centro,12245680,https://sp.olx.com.br/vale-do-paraiba-e-litoral-norte/ciclismo/sinalizador-com-led-jws-ws-207-recarregavel-usb-7-leds-vermelho-amarelo-4-modos-7133-926858217
2520,13/07,12:00,1057525851,"Bike 29 quadro 15  URGENTE  999,00",999000.0,Itapevi,Conjunto Habitacional - Setor A,06665022,https://sp.olx.com.br/sao-paulo-e-regiao/ciclismo/bike-29-quadro-15-urgente-999-00-1057525851
2521,13/07,11:30,1032019710,Sinalizador Epic Line XC-782 Diant. e Tras. Silicone com Led Luz Noturna de Segurança 7511,9.0,São José dos Campos,Vila Ester,12221680,https://sp.olx.com.br/vale-do-paraiba-e-litoral-norte/ciclismo/sinalizador-epic-line-xc-782-diant-e-tras-silicone-com-led-luz-noturna-de-seguranca-7511-1032019710
2522,,,,,,,,,
2523,12/07,23:03,1048267190,Rodas de bike fixa.,1800.0,Pindamonhangaba,Residencial Mombaça I,12425120,https://sp.olx.com.br/vale-do-paraiba-e-litoral-norte/ciclismo/rodas-de-bike-fixa-1048267190
2524,12/07,18:11,1048161260,"Bike Speed, catraca fixa também ",1800.0,São Paulo,Jardim Vergueiro (Sacomã),04166003,https://sp.olx.com.br/sao-paulo-e-regiao/ciclismo/bike-speed-catraca-fixa-tambem-1048161260
2525,12/07,15:43,908574130,Bike aro 29 Venzo toda Shimano Alívio c/nota fiscal,3900.0,Santo André,Centro,09020031,https://sp.olx.com.br/sao-paulo-e-regiao/ciclismo/bike-aro-29-venzo-toda-shimano-alivio-c-nota-fiscal-908574130
2526,12/07,14:43,1057042925,Caloi 10 1986 ,1000.0,Santos,Embaré,11040240,https://sp.olx.com.br/baixada-santista-e-litoral-sul/ciclismo/caloi-10-1986-1057042925
2527,12/07,14:40,1036323055,Fita de Guidão Genesi para Bicicletas Speed Road Gravel Cor Preta em EVA Macio 8371,27.0,São José dos Campos,Vila Ester,12221680,https://sp.olx.com.br/vale-do-paraiba-e-litoral-norte/ciclismo/fita-de-guidao-genesi-para-bicicletas-speed-road-gravel-cor-preta-em-eva-macio-8371-1036323055
2528,12/07,14:38,937280899,Sinalizador com Led Jws WS-211 Recarregável USB 8 Leds Pisca Vermelho 5 Super Forte 7129,26.0,São José dos Campos,Centro,12245680,https://sp.olx.com.br/vale-do-paraiba-e-litoral-norte/ciclismo/sinalizador-com-led-jws-ws-211-recarregavel-usb-8-leds-pisca-vermelho-5-super-forte-7129-937280899
2529,,,,,,,,,
2530,12/07,14:37,912081167,Suporte Avançado de Bike para GPS Garmin Edge Bryton Cateye e Câmera GoPro 7157,45.0,São José dos Campos,Centro,12245680,https://sp.olx.com.br/vale-do-paraiba-e-litoral-norte/ciclismo/suporte-avancado-de-bike-para-gps-garmin-edge-bryton-cateye-e-camera-gopro-7157-912081167
2531,12/07,14:12,938812027,Chave Ferramenta JWS Extrator de Movimento Central Hollowtech e Chave de Cassete 7633,23.0,São José dos Campos,Centro,12245680,https://sp.olx.com.br/vale-do-paraiba-e-litoral-norte/ciclismo/chave-ferramenta-jws-extrator-de-movimento-central-hollowtech-e-chave-de-cassete-7633-938812027
2532,12/07,14:12,935767055,Sinalizador Diant e Tras Epic Line EPL-2215 Bike Luz Noturna 2 Leds Branco e Vermelho 7509,17.0,São José dos Campos,Centro,12245680,https://sp.olx.com.br/vale-do-paraiba-e-litoral-norte/ciclismo/sinalizador-diant-e-tras-epic-line-epl-2215-bike-luz-noturna-2-leds-branco-e-vermelho-7509-935767055
2533,12/07,13:13,930648229,Sinalizador Diant Traseiro Vortex Bike Silicone Luz Noturna 2 Leds Branco e Vermelho 7077,21.0,São José dos Campos,Centro,12245680,https://sp.olx.com.br/vale-do-paraiba-e-litoral-norte/ciclismo/sinalizador-diant-traseiro-vortex-bike-silicone-luz-noturna-2-leds-branco-e-vermelho-7077-930648229
2534,12/07,13:09,935306727,GPS Ciclocomputador para Bikes Absolute Nero Compatível com Strava 7229,180.0,São José dos Campos,Centro,12245680,https://sp.olx.com.br/vale-do-paraiba-e-litoral-norte/ciclismo/gps-ciclocomputador-para-bikes-absolute-nero-compativel-com-strava-7229-935306727
2535,12/07,12:51,909433819,Ferramenta de Reparo Macarrão Para Pneu Tubeless para Bike com Agulha ArStop 3776,52.0,São José dos Campos,Centro,12245680,https://sp.olx.com.br/vale-do-paraiba-e-litoral-norte/ciclismo/ferramenta-de-reparo-macarrao-para-pneu-tubeless-para-bike-com-agulha-arstop-3776-909433819
2536,12/07,12:50,914853771,Chave Jws Instalação Movimento Central Hollowtech Shimano Truvativ Fsa Megaexo 7363,23.0,São José dos Campos,Centro,12245680,https://sp.olx.com.br/vale-do-paraiba-e-litoral-norte/ciclismo/chave-jws-instalacao-movimento-central-hollowtech-shimano-truvativ-fsa-megaexo-7363-914853771
2537,12/07,12:45,1037281317,Sinalizador Led Jws WS-206 Recarregável USB 5 Leds Pisca Vermelho 4 Modos Super Forte 8633,15.0,São José dos Campos,Vila Ester,12221680,https://sp.olx.com.br/vale-do-paraiba-e-litoral-norte/ciclismo/sinalizador-led-jws-ws-206-recarregavel-usb-5-leds-pisca-vermelho-4-modos-super-forte-8633-1037281317
2538,,,,,,,,,
2539,12/07,12:40,1037356762,Guia de Cabo de Câmbio Para Quadro de Bicicleta Speed/MTB Fixação Movimento Central 8613,3.0,São José dos Campos,Vila Ester,12221680,https://sp.olx.com.br/vale-do-paraiba-e-litoral-norte/ciclismo/guia-de-cabo-de-cambio-para-quadro-de-bicicleta-speed-mtb-fixacao-movimento-central-8613-1037356762
2540,12/07,12:36,1039262172,Abraçadeira Para Passadores de Marchas Sram Trigger Shifter XX1 X01 X0 X9 X7 Eagle 5665,24.0,São José dos Campos,Vila Ester,12221680,https://sp.olx.com.br/vale-do-paraiba-e-litoral-norte/ciclismo/abracadeira-para-passadores-de-marchas-sram-trigger-shifter-xx1-x01-x0-x9-x7-eagle-5665-1039262172
2541,12/07,12:36,1039262931,Adaptador De Freio À Disco Shimano IS Para Post Mount Rotor 180/160mm 6505,14.0,São José dos Campos,Vila Ester,12221680,https://sp.olx.com.br/vale-do-paraiba-e-litoral-norte/ciclismo/adaptador-de-freio-disco-shimano-is-para-post-mount-rotor-180-160mm-6505-1039262931
2542,12/07,12:25,945752121,Kit Lanterna Dianteira Bike WS-205 e Sinalizador Traseiro JY-918 JWS Recarregável 7607,80.0,São José dos Campos,Centro,12245680,https://sp.olx.com.br/vale-do-paraiba-e-litoral-norte/ciclismo/kit-lanterna-dianteira-bike-ws-205-e-sinalizador-traseiro-jy-918-jws-recarregavel-7607-945752121
2543,12/07,12:25,931258599,Pezinho Para Bike Descanso Lateral JWS Com Regulagem Preto Aro 20 até 29 7361,33.0,São José dos Campos,Centro,12245680,https://sp.olx.com.br/vale-do-paraiba-e-litoral-norte/ciclismo/pezinho-para-bike-descanso-lateral-jws-com-regulagem-preto-aro-20-ate-29-7361-931258599
2544,12/07,12:24,996207404,"Suporte de Celular Bike e Moto Fixo no Guidão com Touchscreen Prova D'agua até 6,5"" 8355",27.0,São José dos Campos,Centro,12245680,https://sp.olx.com.br/vale-do-paraiba-e-litoral-norte/ciclismo/suporte-de-celular-bike-e-moto-fixo-no-guidao-com-touchscreen-prova-d-agua-ate-6-5-8355-996207404
2545,,,,,,,,,
2546,12/07,12:22,938805621,Lanterna WS-205 800 Lúmens e Sinalizador Led WS-207 Vermelho Amarelo Recarregável 7605,87.0,São José dos Campos,Centro,12245680,https://sp.olx.com.br/vale-do-paraiba-e-litoral-norte/ciclismo/lanterna-ws-205-800-lumens-e-sinalizador-led-ws-207-vermelho-amarelo-recarregavel-7605-938805621
2547,12/07,12:22,931691043,Sinalizador Diant e Tras Jws JY009 Bike Silicone Luz Noturna 2 Leds Branco e Vermelho 7131,17.0,São José dos Campos,Centro,12245680,https://sp.olx.com.br/vale-do-paraiba-e-litoral-norte/ciclismo/sinalizador-diant-e-tras-jws-jy009-bike-silicone-luz-noturna-2-leds-branco-e-vermelho-7131-931691043
2548,12/07,12:12,995892437,Suporte de Celular Veicular Carro Articulado com Ventosa para Painel ou Vidro 8365,20.0,São José dos Campos,Centro,12245680,https://sp.olx.com.br/vale-do-paraiba-e-litoral-norte/ciclismo/suporte-de-celular-veicular-carro-articulado-com-ventosa-para-painel-ou-vidro-8365-995892437
2549,12/07,12:09,923521572,Lanterna Farol Dianteiro para Bike Jws JY-263 Super Led Preto Recarregável 5377,72.0,São José dos Campos,Centro,12245680,https://sp.olx.com.br/vale-do-paraiba-e-litoral-norte/ciclismo/lanterna-farol-dianteiro-para-bike-jws-jy-263-super-led-preto-recarregavel-5377-923521572
2550,12/07,12:09,924800512,Sinalizador com Led 100 Lumens Jws WS-212 Recarregável USB Led Vermelho e Branco 5365,44.0,São José dos Campos,Centro,12245680,https://sp.olx.com.br/vale-do-paraiba-e-litoral-norte/ciclismo/sinalizador-com-led-100-lumens-jws-ws-212-recarregavel-usb-led-vermelho-e-branco-5365-924800512
2551,12/07,12:04,924773056,Pedal de encaixe Clip Bike Mountain-Bike Wellgo M919 Preto C/ Taquinhos tipo Shimano 5439,271.0,São José dos Campos,Centro,12245680,https://sp.olx.com.br/vale-do-paraiba-e-litoral-norte/ciclismo/pedal-de-encaixe-clip-bike-mountain-bike-wellgo-m919-preto-c-taquinhos-tipo-shimano-5439-924773056
2552,12/07,11:59,923933472,Suporte Cavalete para Manutenção de Bikes Portátil com Bandeja para Ferramentas 6575,396.0,São José dos Campos,Centro,12245680,https://sp.olx.com.br/vale-do-paraiba-e-litoral-norte/ciclismo/suporte-cavalete-para-manutencao-de-bikes-portatil-com-bandeja-para-ferramentas-6575-923933472
2553,,,,,,,,,
2554,12/07,11:54,910556925,Farol Bikes Super Led Cree T6 Bateria Recarregável 4 células Zoom e Foco Ajustável 6607,81.0,São José dos Campos,Centro,12245680,https://sp.olx.com.br/vale-do-paraiba-e-litoral-norte/ciclismo/farol-bikes-super-led-cree-t6-bateria-recarregavel-4-celulas-zoom-e-foco-ajustavel-6607-910556925
2555,12/07,07:09,1056841263,Bike 29 Oggi 7.0 2022 kit Shimano Alívio ,3399.0,São Paulo,Jardim Santo Elias,05110000,https://sp.olx.com.br/sao-paulo-e-regiao/ciclismo/bike-29-oggi-7-0-2022-kit-shimano-alivio-1056841263
2556,11/07,18:17,1056711557,Bike motorizada (leia com atenção),1000.0,São Paulo,Cidade São Mateus,03964020,https://sp.olx.com.br/sao-paulo-e-regiao/ciclismo/bike-motorizada-leia-com-atencao-1056711557
2557,11/07,17:02,1036273478,Bike fixa Vicini,3200.0,Jacareí,Parque Santo Antônio,12309660,https://sp.olx.com.br/vale-do-paraiba-e-litoral-norte/ciclismo/bike-fixa-vicini-1036273478
2558,11/07,14:37,1056609131,Caloi 15 1979,1600.0,Santos,Embaré,11040240,https://sp.olx.com.br/baixada-santista-e-litoral-sul/ciclismo/caloi-15-1979-1056609131
2559,09/07,22:32,1035524026,Pisca Led Vista Light Farol Bike Sinalização Alumínio,25.0,Praia Grande,Guilhermina,11702300,https://sp.olx.com.br/baixada-santista-e-litoral-sul/ciclismo/pisca-led-vista-light-farol-bike-sinalizacao-aluminio-1035524026
2560,,,,,,,,,
2561,09/07,19:39,1056056431,Bicicleta Speed Soul Expresso Fixa - TAM 51,3000.0,Indaiatuba,Vila Todos os Santos,13330615,https://sp.olx.com.br/grande-campinas/ciclismo/bicicleta-speed-soul-expresso-fixa-tam-51-1056056431
2562,09/07,11:15,1055877294,Capacete bicicleta Original Schwinn Adulto Branco/rosa Tamanho Único,90.0,Guarulhos,Cidade Seródio,07150020,https://sp.olx.com.br/sao-paulo-e-regiao/ciclismo/capacete-bicicleta-original-schwinn-adulto-branco-rosa-tamanho-unico-1055877294
2563,08/07,17:16,1055586489,BIKE FIXA / CALOI 10 FIXA + BRINDES,800.0,Guarulhos,Centro,07012031,https://sp.olx.com.br/sao-paulo-e-regiao/ciclismo/bike-fixa-caloi-10-fixa-brindes-1055586489
2564,08/07,11:41,1055424205,Rolo de Treinamento Absolute,520.0,São Paulo,Santo Amaro,04743030,https://sp.olx.com.br/sao-paulo-e-regiao/ciclismo/rolo-de-treinamento-absolute-1055424205
2565,08/07,09:51,1055354695,Bicicleta aro 29 Oggi Big Wheel 7.0 2022 kit shimano Alívio ,3400.0,São Paulo,Parque Anhangüera (São Domingos),05158000,https://sp.olx.com.br/sao-paulo-e-regiao/ciclismo/bicicleta-aro-29-oggi-big-wheel-7-0-2022-kit-shimano-alivio-1055354695
2566,08/07,08:48,1055309535,Bike fixa,1200.0,São Paulo,Vila Ema,03277030,https://sp.olx.com.br/sao-paulo-e-regiao/ciclismo/bike-fixa-1055309535
2567,07/07,19:02,1046325389,Bike aro 26,700.0,Praia Grande,Vila Sônia,11722190,https://sp.olx.com.br/baixada-santista-e-litoral-sul/ciclismo/bike-aro-26-1046325389
2568,07/07,15:02,1033556315,Caloi 10 retrô hibrida fixa,900.0,Taubaté,Chácaras Cataguá,12093420,https://sp.olx.com.br/vale-do-paraiba-e-litoral-norte/ciclismo/caloi-10-retro-hibrida-fixa-1033556315
2569,06/07,15:31,1034329232,BIKE LIMOUSINE DUPLA PROTÓTIPO 001,1500.0,Santos,Aparecida,11025201,https://sp.olx.com.br/baixada-santista-e-litoral-sul/ciclismo/bike-limousine-dupla-prototipo-001-1034329232
2570,06/07,13:01,1034215399,Bike fixa vicinitech personalizada.,3999.0,Pindamonhangaba,Residencial Mombaça I,12425120,https://sp.olx.com.br/vale-do-paraiba-e-litoral-norte/ciclismo/bike-fixa-vicinitech-personalizada-1034215399
2571,06/07,12:16,1034273872,Aro 20 Bike ( na caixa) PROMOÇÃO ,519.0,São Paulo,Jardim São Paulo(Zona Norte),02040000,https://sp.olx.com.br/sao-paulo-e-regiao/ciclismo/aro-20-bike-na-caixa-promocao-1034273872
2572,06/07,12:16,1045665586, Kit Farol E Lanterna Bicicleta Bike Ultra Led A Prova D'água usb Recarregável,47.0,Ribeirão Preto,Ipiranga,14055080,https://sp.olx.com.br/regiao-de-ribeirao-preto/ciclismo/kit-farol-e-lanterna-bicicleta-bike-ultra-led-a-prova-d-agua-usb-recarregavel-1045665586
2573,06/07,10:42,1054434118,Caloi SS3 1976,500.0,Santos,Embaré,11040240,https://sp.olx.com.br/baixada-santista-e-litoral-sul/ciclismo/caloi-ss3-1976-1054434118
2574,06/07,10:21,1054425706,Caloi Peri 1979,750.0,Santos,Embaré,11040240,https://sp.olx.com.br/baixada-santista-e-litoral-sul/ciclismo/caloi-peri-1979-1054425706
2575,06/07,09:00,1054391334,Cadeirinha Kid Bike Preta Semi-Nova,100.0,Taubaté,Jardim Califórnia,12062150,https://sp.olx.com.br/vale-do-paraiba-e-litoral-norte/ciclismo/cadeirinha-kid-bike-preta-semi-nova-1054391334
2576,05/07,21:32,1045541025,coroa aluminio 39 dentes BCD 110 ,80.0,São Bernardo do Campo,Rudge Ramos,09631040,https://sp.olx.com.br/sao-paulo-e-regiao/ciclismo/coroa-aluminio-39-dentes-bcd-110-1045541025
2577,05/07,16:31,1045472650,Suporte de bike parede ,55.0,Jacareí,Jardim do Portal,12324230,https://sp.olx.com.br/vale-do-paraiba-e-litoral-norte/ciclismo/suporte-de-bike-parede-1045472650
2578,,,,,,,,,
2579,05/07,09:58,1037093630,Rodas Road Bike Speed Fixa - Corsa Com Eixo Passante De 12mm,2100.0,Santo André,Campestre,09070250,https://sp.olx.com.br/sao-paulo-e-regiao/ciclismo/rodas-road-bike-speed-fixa-corsa-com-eixo-passante-de-12mm-1037093630
2580,05/07,08:16,1053883258,"Bike 29 Oggi Big Wheel 7.0 2022 kit Shimano Alívio 18,v ",3399.0,São Paulo,Jardim Líbano,05138200,https://sp.olx.com.br/sao-paulo-e-regiao/ciclismo/bike-29-oggi-big-wheel-7-0-2022-kit-shimano-alivio-18-v-1053883258
2581,04/07,22:31,1033622354,"farol bike led com buzina recarregavel(vermelho) produto novo, entrega feita pelo olx pay",57.0,São José dos Campos,Jardim Satélite,12230730,https://sp.olx.com.br/vale-do-paraiba-e-litoral-norte/ciclismo/farol-bike-led-com-buzina-recarregavel-vermelho-produto-novo-entrega-feita-pelo-olx-pay-1033622354
2582,04/07,13:48,1053539668,Bicicleta Kestrel MXZ 1989,2999.0,São Paulo,Vila União (Zona Leste),03683000,https://sp.olx.com.br/sao-paulo-e-regiao/ciclismo/bicicleta-kestrel-mxz-1989-1053539668
2583,04/07,13:01,1044921976,Suporte Teto P/ 1 Bicicleta Fixa A Bike Pelo Garfo,100.0,Pindorama,undef,15830000,https://sp.olx.com.br/regiao-de-sao-jose-do-rio-preto/ciclismo/suporte-teto-p-1-bicicleta-fixa-a-bike-pelo-garfo-1044921976
2584,03/07,16:16,1053246487,Bike fixa,1500.0,São Bernardo do Campo,Centro,09715060,https://sp.olx.com.br/sao-paulo-e-regiao/ciclismo/bike-fixa-1053246487
2585,,,,,,,,,
2586,03/07,16:02,1033171022,Cubo Joytech e Vbrake Gama,115.0,São Paulo,Jardim Rodolfo Pirani,08310060,https://sp.olx.com.br/sao-paulo-e-regiao/ciclismo/cubo-joytech-e-vbrake-gama-1033171022
2587,03/07,10:31,1053148807,Vendo rolo de bike fixo,130.0,Votorantim,Parque Jataí,18117250,https://sp.olx.com.br/regiao-de-sorocaba/ciclismo/vendo-rolo-de-bike-fixo-1053148807
2588,02/07,11:03,1052853831,Bicicleta Caloi Atacama/ 27vel/ Alivio/Hidráulico/Susp Ar.,2300.0,Caieiras,Região Central,07700665,https://sp.olx.com.br/sao-paulo-e-regiao/ciclismo/bicicleta-caloi-atacama-27vel-alivio-hidraulico-susp-ar-1052853831
2589,02/07,09:37,1052813495,Bike fixa,400.0,São Paulo,Jardim Celeste,05527000,https://sp.olx.com.br/sao-paulo-e-regiao/ciclismo/bike-fixa-1052813495
2590,01/07,22:31,1032282012,Bicicleta Urbana Audax Havok City LT 24v 2021 - Nova na caixa c/ Seguro,2599.0,São Paulo,Indianópolis,04062003,https://sp.olx.com.br/sao-paulo-e-regiao/ciclismo/bicicleta-urbana-audax-havok-city-lt-24v-2021-nova-na-caixa-c-seguro-1032282012
2591,01/07,20:36,1052676156,Rolo de treino ,160.0,Campo Limpo Paulista,Jardim Marcheti,13232450,https://sp.olx.com.br/sao-paulo-e-regiao/ciclismo/rolo-de-treino-1052676156
2592,01/07,19:01,1032278308,Bicicleta MTB Audax Havok TX 24v 2021 - Nova na caixa c/ Seguro,2799.0,São Paulo,Indianópolis,04062003,https://sp.olx.com.br/sao-paulo-e-regiao/ciclismo/bicicleta-mtb-audax-havok-tx-24v-2021-nova-na-caixa-c-seguro-1032278308
2593,01/07,17:31,1044073438,Transbike para caçamba de pickup / caminhonete / utilitário,200.0,São José dos Campos,Bosque dos Eucaliptos,12232110,https://sp.olx.com.br/vale-do-paraiba-e-litoral-norte/ciclismo/transbike-para-cacamba-de-pickup-caminhonete-utilitario-1044073438
2594,,,,,,,,,
