,dayPost,timePost,codeAd,nameBike,valueBike,city,neighborhood,cep,urlBike
0,17/02,20:30,1148746521,Bicicleta Tropical Fixa,1250.0,Santos,Embaré,11040240,https://sp.olx.com.br/baixada-santista-e-litoral-sul/ciclismo/bicicleta-tropical-fixa-1148746521
1,17/02,17:05,1144151449,Cadeirinha para bike Polisport Bilby Jr ,280.0,Presidente Venceslau,Centro,19400099,https://sp.olx.com.br/regiao-de-presidente-prudente/ciclismo/cadeirinha-para-bike-polisport-bilby-jr-1144151449
2,,,,,,,,,
3,17/02,16:02,1144058188,"Rolo de Treino / Treinamento , modelo Fixo Dobrável.",100.0,Araraquara,Jardim das Flores,14801788,https://sp.olx.com.br/regiao-de-ribeirao-preto/ciclismo/rolo-de-treino-treinamento-modelo-fixo-dobravel-1144058188
4,17/02,16:02,1142432384,Bicicleta Fixa | Chandan BikeCo. ,2000.0,São Paulo,Cambuci,01540050,https://sp.olx.com.br/sao-paulo-e-regiao/ciclismo/bicicleta-fixa-chandan-bikeco-1142432384
5,17/02,15:32,1144938051,Rack Thule Euroride Traseira Reboque 2 Bicicletas,2350.0,São Paulo,Ipiranga,04204030,https://sp.olx.com.br/sao-paulo-e-regiao/ciclismo/rack-thule-euroride-traseira-reboque-2-bicicletas-1144938051
6,17/02,14:01,1144930496,Transbike com rack de teto na promoção,700.0,undef,undef,00000000,https://sp.olx.com.br/baixada-santista-e-litoral-sul/ciclismo/transbike-com-rack-de-teto-na-promocao-1144930496
7,17/02,12:32,1147375886,Bicicleta Dobrável Caloi anos 80,1400.0,São Paulo,Vila Nova Conceição,04513080,https://sp.olx.com.br/sao-paulo-e-regiao/ciclismo/bicicleta-dobravel-caloi-anos-80-1147375886
8,17/02,11:31,1140213436,Bike Fixa Cernunnos Attack Edição Especial Galaxia Tamanho 54 Exepcional ,5500.0,São José do Rio Preto,Parque Industrial,15025045,https://sp.olx.com.br/regiao-de-sao-jose-do-rio-preto/ciclismo/bike-fixa-cernunnos-attack-edicao-especial-galaxia-tamanho-54-exepcional-1140213436
9,,,,,,,,,
10,17/02,09:31,1147430506,rodas DT Swiss para bike fixa,1750.0,São Paulo,Vila Clementino,04042003,https://sp.olx.com.br/sao-paulo-e-regiao/ciclismo/rodas-dt-swiss-para-bike-fixa-1147430506
11,17/02,01:05,1148341983,Bike fixa,900.0,Santos,Morro São Bento,11082030,https://sp.olx.com.br/baixada-santista-e-litoral-sul/ciclismo/bike-fixa-1148341983
12,16/02,22:17,1098946038,Bicicleta Urbana Groove Cosmopolitan 7v 2021 - Nova na caixa,2199.0,São Paulo,Indianópolis,04062003,https://sp.olx.com.br/sao-paulo-e-regiao/ciclismo/bicicleta-urbana-groove-cosmopolitan-7v-2021-nova-na-caixa-1098946038
13,16/02,22:00,1148308918,Transbike Gts m1 Force para 2 Bicicletas,150.0,Bauru,Jardim Alvorada,17033841,https://sp.olx.com.br/regiao-de-bauru-e-marilia/ciclismo/transbike-gts-m1-force-para-2-bicicletas-1148308918
14,16/02,21:29,1148298376,Bicicleta 26 Freeride Insano ( Nova ),1390.0,Americana,Centro,13465023,https://sp.olx.com.br/grande-campinas/ciclismo/bicicleta-26-freeride-insano-nova-1148298376
15,16/02,20:31,1146196165,Cadeira para bicicleta kalf,90.0,São Paulo,Vila Romana,05061100,https://sp.olx.com.br/sao-paulo-e-regiao/ciclismo/cadeira-para-bicicleta-kalf-1146196165
16,16/02,20:17,1148271859,Specialized Mika 700x38C,1700.0,Bebedouro,Parque Residencial Eldorado,14706112,https://sp.olx.com.br/regiao-de-sao-jose-do-rio-preto/ciclismo/specialized-mika-700x38c-1148271859
17,16/02,20:01,1148267929,Bike fixa riva Phantom ,3290.0,São Paulo,Indianópolis,04517000,https://sp.olx.com.br/sao-paulo-e-regiao/ciclismo/bike-fixa-riva-phantom-1148267929
18,,,,,,,,,
19,16/02,19:02,1145390651,Bicicleta fixa Vicinitech Pista ST 51cm TT 55cm,4000.0,São Paulo,Limão,02710001,https://sp.olx.com.br/sao-paulo-e-regiao/ciclismo/bicicleta-fixa-vicinitech-pista-st-51cm-tt-55cm-1145390651
20,16/02,18:32,1140950805,Bicicleta usada em bom estado para criança metade do valor da loja,400.0,São Paulo,Jardim das Oliveiras,08111190,https://sp.olx.com.br/sao-paulo-e-regiao/ciclismo/bicicleta-usada-em-bom-estado-para-crianca-metade-do-valor-da-loja-1140950805
21,16/02,18:26,1148220562,Teste Bike fixa,4990.0,São José do Rio Preto,Parque Industrial,15025045,https://sp.olx.com.br/regiao-de-sao-jose-do-rio-preto/ciclismo/teste-bike-fixa-1148220562
22,16/02,17:02,1142928159,Bike fixa vicini pista-x2,3900.0,São Paulo,Vila Nivi,02254010,https://sp.olx.com.br/sao-paulo-e-regiao/ciclismo/bike-fixa-vicini-pista-x2-1142928159
23,16/02,16:32,1140134634,Rolo bike Elite Novo Force muito pouco uso,1500.0,São Paulo,Barra Funda,01154001,https://sp.olx.com.br/sao-paulo-e-regiao/ciclismo/rolo-bike-elite-novo-force-muito-pouco-uso-1140134634
24,16/02,16:31,1145609497,Suporte para carregar 3 bikes,650.0,Mogi das Cruzes,Conjunto Residencial do Bosque,08743010,https://sp.olx.com.br/sao-paulo-e-regiao/ciclismo/suporte-para-carregar-3-bikes-1145609497
25,,,,,,,,,
26,16/02,16:02,1144513519,Bike fixa Tetrapode -LEIA O ANÚNCIO,980.0,Limeira,Jardim Nossa Senhora de Fátima,13482375,https://sp.olx.com.br/grande-campinas/ciclismo/bike-fixa-tetrapode-leia-o-anuncio-1144513519
27,16/02,15:33,1140019580,Bicicleta drb bike freeway,2900.0,Jandira,Vale do Sol,06620300,https://sp.olx.com.br/sao-paulo-e-regiao/ciclismo/bicicleta-drb-bike-freeway-1140019580
28,16/02,14:32,1144780531,BOLSA QUADRO VERCELLI PARA BIKE TOUCH-SCREEN,39.0,Mogi das Cruzes,Vila Nova Cintra,08744090,https://sp.olx.com.br/sao-paulo-e-regiao/ciclismo/bolsa-quadro-vercelli-para-bike-touch-screen-1144780531
29,16/02,14:02,1142066056,Bike caroninha seminova aro 20.,650.0,Mogi das Cruzes,Alto da Boa Vista,08715640,https://sp.olx.com.br/sao-paulo-e-regiao/ciclismo/bike-caroninha-seminova-aro-20-1142066056
30,16/02,14:01,1146936435,Suporte Bagageiro Bike Aluminio Fixação No Canote,100.0,São Paulo,Cidade Monções,04563908,https://sp.olx.com.br/sao-paulo-e-regiao/ciclismo/suporte-bagageiro-bike-aluminio-fixacao-no-canote-1146936435
31,16/02,13:39,1147981867,Bike fixa - single tam. 56,1200.0,São Paulo,Vila Clementino,04037000,https://sp.olx.com.br/sao-paulo-e-regiao/ciclismo/bike-fixa-single-tam-56-1147981867
32,16/02,13:01,1141021834,Bike Fixa Chandan Tam 54x55,2000.0,São Paulo,Vila Brasílio Machado,04289137,https://sp.olx.com.br/sao-paulo-e-regiao/ciclismo/bike-fixa-chandan-tam-54x55-1141021834
33,,,,,,,,,
34,16/02,12:01,1141882261,Rolo treino fixo Absolute,295.0,Osasco,Jaguaribe,06050240,https://sp.olx.com.br/sao-paulo-e-regiao/ciclismo/rolo-treino-fixo-absolute-1141882261
35,16/02,11:31,1142085055,Bike single tam. 56. Sunburst ,1700.0,São Paulo,Vila Clementino,04037000,https://sp.olx.com.br/sao-paulo-e-regiao/ciclismo/bike-single-tam-56-sunburst-1142085055
36,16/02,11:09,1147907052,Bicicleta Retrô Nathor,1890.0,Santo André,Centro,09010000,https://sp.olx.com.br/sao-paulo-e-regiao/ciclismo/bicicleta-retro-nathor-1147907052
37,16/02,09:31,1147279668,Bike Fixa RAF ,1500.0,São Paulo,Vila Butantã,05360030,https://sp.olx.com.br/sao-paulo-e-regiao/ciclismo/bike-fixa-raf-1147279668
38,16/02,09:02,1147282401,Bike fixa,2500.0,Taubaté,Chácara Santa Luzia,12091420,https://sp.olx.com.br/vale-do-paraiba-e-litoral-norte/ciclismo/bike-fixa-1147282401
39,15/02,19:26,854820762,Bike/Venzo aro 29 kit Alívio sem um Risco,3200.0,Santo André,Centro,09020031,https://sp.olx.com.br/sao-paulo-e-regiao/ciclismo/bike-venzo-aro-29-kit-alivio-sem-um-risco-854820762
40,,,,,,,,,
41,15/02,14:17,1147561213,Kit freio ferradura dianteiro tektro bike fixa Specialized ,100.0,São Paulo,Santana,02035011,https://sp.olx.com.br/sao-paulo-e-regiao/ciclismo/kit-freio-ferradura-dianteiro-tektro-bike-fixa-specialized-1147561213
42,15/02,13:40,1147544572,"rolo fixo de treino ciclismo - serve p speed 700cc / mtb 26, 27.5, 29",0.0,Mogi das Cruzes,Mogi Moderno,08717435,https://sp.olx.com.br/sao-paulo-e-regiao/ciclismo/rolo-fixo-de-treino-ciclismo-serve-p-speed-700cc-mtb-26-27-5-29-1147544572
43,15/02,13:25,1147539637,Lanterna Traseira Bike Sinalizador Bicicleta Farol Led Luz Segurança Super Potente,39.0,São José dos Campos,Conjunto Residencial Trinta e Um de Março,12237010,https://sp.olx.com.br/vale-do-paraiba-e-litoral-norte/ciclismo/lanterna-traseira-bike-sinalizador-bicicleta-farol-led-luz-seguranca-super-potente-1147539637
44,15/02,11:01,1127138793,Lanterna De Cabeça E Farol Bike + Alerta Traseiro B-max,130.0,Sertãozinho,Jardim Recreio,14170370,https://sp.olx.com.br/regiao-de-ribeirao-preto/ciclismo/lanterna-de-cabeca-e-farol-bike-alerta-traseiro-b-max-1127138793
45,14/02,16:23,1030404483,Rodinha Lateral para Bicicleta Infantil Aro 16 Roda de Equilíbrio 8652,21.0,São José dos Campos,Centro,12245680,https://sp.olx.com.br/vale-do-paraiba-e-litoral-norte/ciclismo/rodinha-lateral-para-bicicleta-infantil-aro-16-roda-de-equilibrio-8652-1030404483
46,14/02,15:40,1147153668,Peças para bicicleta speed single fixa,15.0,São Paulo,Vila União (Zona Leste),03683000,https://sp.olx.com.br/sao-paulo-e-regiao/ciclismo/pecas-para-bicicleta-speed-single-fixa-1147153668
47,14/02,15:34,1147151830,Bicicleta mtb carbono Kestrel 1989,1998.0,São Paulo,Vila União (Zona Leste),03683000,https://sp.olx.com.br/sao-paulo-e-regiao/ciclismo/bicicleta-mtb-carbono-kestrel-1989-1147151830
48,14/02,15:25,1147148981,Peças para bicicleta mtb ,15.0,São Paulo,Vila União (Zona Leste),03683000,https://sp.olx.com.br/sao-paulo-e-regiao/ciclismo/pecas-para-bicicleta-mtb-1147148981
49,14/02,15:05,912081167,Suporte Avançado de Bike para GPS Garmin Edge Bryton Cateye e Câmera GoPro 7157,45.0,São José dos Campos,Centro,12245680,https://sp.olx.com.br/vale-do-paraiba-e-litoral-norte/ciclismo/suporte-avancado-de-bike-para-gps-garmin-edge-bryton-cateye-e-camera-gopro-7157-912081167
50,14/02,15:05,937280899,Sinalizador com Led Jws WS-211 Recarregável USB 8 Leds Pisca Vermelho 5 Super Forte 7129,26.0,São José dos Campos,Centro,12245680,https://sp.olx.com.br/vale-do-paraiba-e-litoral-norte/ciclismo/sinalizador-com-led-jws-ws-211-recarregavel-usb-8-leds-pisca-vermelho-5-super-forte-7129-937280899
51,14/02,14:44,1030409572,Pedal de encaixe Clip Bicicleta Mountain-Bike Shimano M520 Preto Com Taquinhos Sh-51 1277,405.0,São José dos Campos,Vila Ester,12221680,https://sp.olx.com.br/vale-do-paraiba-e-litoral-norte/ciclismo/pedal-de-encaixe-clip-bicicleta-mountain-bike-shimano-m520-preto-com-taquinhos-sh-51-1277-1030409572
52,14/02,14:44,1028488988,Passador Shimano Deore XT M780 I-Spec 2 e 3x10 velocidades - Usado 8862,396.0,São José dos Campos,Centro,12245680,https://sp.olx.com.br/vale-do-paraiba-e-litoral-norte/ciclismo/passador-shimano-deore-xt-m780-i-spec-2-e-3x10-velocidades-usado-8862-1028488988
53,14/02,14:44,935767055,Sinalizador Diant e Tras Epic Line EPL-2215 Bike Luz Noturna 2 Leds Branco e Vermelho 7509,17.0,São José dos Campos,Centro,12245680,https://sp.olx.com.br/vale-do-paraiba-e-litoral-norte/ciclismo/sinalizador-diant-e-tras-epic-line-epl-2215-bike-luz-noturna-2-leds-branco-e-vermelho-7509-935767055
54,14/02,14:44,938812027,Chave Ferramenta JWS Extrator de Movimento Central Hollowtech e Chave de Cassete 7633,23.0,São José dos Campos,Centro,12245680,https://sp.olx.com.br/vale-do-paraiba-e-litoral-norte/ciclismo/chave-ferramenta-jws-extrator-de-movimento-central-hollowtech-e-chave-de-cassete-7633-938812027
55,14/02,14:32,1048088672,Prolongador de Válvula Presta para Câmara de Ar Bicicleta Road 70mm 8835,35.0,São José dos Campos,Centro,12245680,https://sp.olx.com.br/vale-do-paraiba-e-litoral-norte/ciclismo/prolongador-de-valvula-presta-para-camara-de-ar-bicicleta-road-70mm-8835-1048088672
56,15/02,13:40,1147544572,"rolo fixo de treino ciclismo - serve p speed 700cc / mtb 26, 27.5, 29",0.0,Mogi das Cruzes,Mogi Moderno,08717435,https://sp.olx.com.br/sao-paulo-e-regiao/ciclismo/rolo-fixo-de-treino-ciclismo-serve-p-speed-700cc-mtb-26-27-5-29-1147544572
57,15/02,13:25,1147539637,Lanterna Traseira Bike Sinalizador Bicicleta Farol Led Luz Segurança Super Potente,39.0,São José dos Campos,Conjunto Residencial Trinta e Um de Março,12237010,https://sp.olx.com.br/vale-do-paraiba-e-litoral-norte/ciclismo/lanterna-traseira-bike-sinalizador-bicicleta-farol-led-luz-seguranca-super-potente-1147539637
58,,,,,,,,,
59,15/02,11:01,1127138793,Lanterna De Cabeça E Farol Bike + Alerta Traseiro B-max,130.0,Sertãozinho,Jardim Recreio,14170370,https://sp.olx.com.br/regiao-de-ribeirao-preto/ciclismo/lanterna-de-cabeca-e-farol-bike-alerta-traseiro-b-max-1127138793
60,14/02,18:54,1147238086,Bicicleta Single Speed aro 700 tamanho 54,799.0,São Caetano do Sul,Boa Vista,09572100,https://sp.olx.com.br/sao-paulo-e-regiao/ciclismo/bicicleta-single-speed-aro-700-tamanho-54-1147238086
61,14/02,16:23,1030404483,Rodinha Lateral para Bicicleta Infantil Aro 16 Roda de Equilíbrio 8652,21.0,São José dos Campos,Centro,12245680,https://sp.olx.com.br/vale-do-paraiba-e-litoral-norte/ciclismo/rodinha-lateral-para-bicicleta-infantil-aro-16-roda-de-equilibrio-8652-1030404483
62,14/02,15:40,1147153668,Peças para bicicleta speed single fixa,15.0,São Paulo,Vila União (Zona Leste),03683000,https://sp.olx.com.br/sao-paulo-e-regiao/ciclismo/pecas-para-bicicleta-speed-single-fixa-1147153668
63,14/02,15:34,1147151830,Bicicleta mtb carbono Kestrel 1989,1998.0,São Paulo,Vila União (Zona Leste),03683000,https://sp.olx.com.br/sao-paulo-e-regiao/ciclismo/bicicleta-mtb-carbono-kestrel-1989-1147151830
64,14/02,15:25,1147148981,Peças para bicicleta mtb ,15.0,São Paulo,Vila União (Zona Leste),03683000,https://sp.olx.com.br/sao-paulo-e-regiao/ciclismo/pecas-para-bicicleta-mtb-1147148981
65,,,,,,,,,
66,14/02,15:05,912081167,Suporte Avançado de Bike para GPS Garmin Edge Bryton Cateye e Câmera GoPro 7157,45.0,São José dos Campos,Centro,12245680,https://sp.olx.com.br/vale-do-paraiba-e-litoral-norte/ciclismo/suporte-avancado-de-bike-para-gps-garmin-edge-bryton-cateye-e-camera-gopro-7157-912081167
67,14/02,15:05,937280899,Sinalizador com Led Jws WS-211 Recarregável USB 8 Leds Pisca Vermelho 5 Super Forte 7129,26.0,São José dos Campos,Centro,12245680,https://sp.olx.com.br/vale-do-paraiba-e-litoral-norte/ciclismo/sinalizador-com-led-jws-ws-211-recarregavel-usb-8-leds-pisca-vermelho-5-super-forte-7129-937280899
68,14/02,14:44,1030409572,Pedal de encaixe Clip Bicicleta Mountain-Bike Shimano M520 Preto Com Taquinhos Sh-51 1277,405.0,São José dos Campos,Vila Ester,12221680,https://sp.olx.com.br/vale-do-paraiba-e-litoral-norte/ciclismo/pedal-de-encaixe-clip-bicicleta-mountain-bike-shimano-m520-preto-com-taquinhos-sh-51-1277-1030409572
69,14/02,14:44,1028488988,Passador Shimano Deore XT M780 I-Spec 2 e 3x10 velocidades - Usado 8862,396.0,São José dos Campos,Centro,12245680,https://sp.olx.com.br/vale-do-paraiba-e-litoral-norte/ciclismo/passador-shimano-deore-xt-m780-i-spec-2-e-3x10-velocidades-usado-8862-1028488988
70,14/02,14:44,935767055,Sinalizador Diant e Tras Epic Line EPL-2215 Bike Luz Noturna 2 Leds Branco e Vermelho 7509,17.0,São José dos Campos,Centro,12245680,https://sp.olx.com.br/vale-do-paraiba-e-litoral-norte/ciclismo/sinalizador-diant-e-tras-epic-line-epl-2215-bike-luz-noturna-2-leds-branco-e-vermelho-7509-935767055
71,14/02,14:44,938812027,Chave Ferramenta JWS Extrator de Movimento Central Hollowtech e Chave de Cassete 7633,23.0,São José dos Campos,Centro,12245680,https://sp.olx.com.br/vale-do-paraiba-e-litoral-norte/ciclismo/chave-ferramenta-jws-extrator-de-movimento-central-hollowtech-e-chave-de-cassete-7633-938812027
72,14/02,14:32,1048088672,Prolongador de Válvula Presta para Câmara de Ar Bicicleta Road 70mm 8835,35.0,São José dos Campos,Centro,12245680,https://sp.olx.com.br/vale-do-paraiba-e-litoral-norte/ciclismo/prolongador-de-valvula-presta-para-camara-de-ar-bicicleta-road-70mm-8835-1048088672
73,14/02,14:32,1048128751,Sinalizador com Led Recarregável USB Led Branco/Vermelho 4 Modos Super Forte 8828,10.0,São José dos Campos,Centro,12245680,https://sp.olx.com.br/vale-do-paraiba-e-litoral-norte/ciclismo/sinalizador-com-led-recarregavel-usb-led-branco-vermelho-4-modos-super-forte-8828-1048128751
74,,,,,,,,,
75,14/02,13:30,935302172,Kit 2x Sinalizadores em Silicone Luz Noturna com 2 Leds Pisca Vermelho 9273,9.0,São José dos Campos,Centro,12245680,https://sp.olx.com.br/vale-do-paraiba-e-litoral-norte/ciclismo/kit-2x-sinalizadores-em-silicone-luz-noturna-com-2-leds-pisca-vermelho-9273-935302172
76,14/02,13:30,938253421,Fita de Guidão Cor Preta p/ Bicicleta Speed Kiwi Emborrachada 2mm Espessura 9344,45.0,São José dos Campos,Centro,12245680,https://sp.olx.com.br/vale-do-paraiba-e-litoral-norte/ciclismo/fita-de-guidao-cor-preta-p-bicicleta-speed-kiwi-emborrachada-2mm-espessura-9344-938253421
77,14/02,13:27,995892437,Suporte de Celular Veicular Carro Articulado com Ventosa para Painel ou Vidro 8365,20.0,São José dos Campos,Centro,12245680,https://sp.olx.com.br/vale-do-paraiba-e-litoral-norte/ciclismo/suporte-de-celular-veicular-carro-articulado-com-ventosa-para-painel-ou-vidro-8365-995892437
78,14/02,13:27,924800512,Sinalizador com Led 100 Lumens Jws WS-212 Recarregável USB Led Vermelho e Branco 5365,44.0,São José dos Campos,Centro,12245680,https://sp.olx.com.br/vale-do-paraiba-e-litoral-norte/ciclismo/sinalizador-com-led-100-lumens-jws-ws-212-recarregavel-usb-led-vermelho-e-branco-5365-924800512
79,14/02,13:25,924773056,Pedal de encaixe Clip Bike Mountain-Bike Wellgo M919 Preto C/ Taquinhos tipo Shimano 5439,271.0,São José dos Campos,Centro,12245680,https://sp.olx.com.br/vale-do-paraiba-e-litoral-norte/ciclismo/pedal-de-encaixe-clip-bike-mountain-bike-wellgo-m919-preto-c-taquinhos-tipo-shimano-5439-924773056
80,14/02,13:25,910556925,Farol Bikes Super Led Cree T6 Bateria Recarregável 4 células Zoom e Foco Ajustável 6607,81.0,São José dos Campos,Centro,12245680,https://sp.olx.com.br/vale-do-paraiba-e-litoral-norte/ciclismo/farol-bikes-super-led-cree-t6-bateria-recarregavel-4-celulas-zoom-e-foco-ajustavel-6607-910556925
81,,,,,,,,,
82,14/02,13:25,931258599,Pezinho Para Bike Descanso Lateral JWS Com Regulagem Preto Aro 20 até 29 7361,33.0,São José dos Campos,Centro,12245680,https://sp.olx.com.br/vale-do-paraiba-e-litoral-norte/ciclismo/pezinho-para-bike-descanso-lateral-jws-com-regulagem-preto-aro-20-ate-29-7361-931258599
83,14/02,13:25,996207404,"Suporte de Celular Bike e Moto Fixo no Guidão com Touchscreen Prova D'agua até 6,5"" 8355",27.0,São José dos Campos,Centro,12245680,https://sp.olx.com.br/vale-do-paraiba-e-litoral-norte/ciclismo/suporte-de-celular-bike-e-moto-fixo-no-guidao-com-touchscreen-prova-d-agua-ate-6-5-8355-996207404
84,14/02,13:25,938805621,Lanterna WS-205 800 Lúmens e Sinalizador Led WS-207 Vermelho Amarelo Recarregável 7605,87.0,São José dos Campos,Centro,12245680,https://sp.olx.com.br/vale-do-paraiba-e-litoral-norte/ciclismo/lanterna-ws-205-800-lumens-e-sinalizador-led-ws-207-vermelho-amarelo-recarregavel-7605-938805621
85,14/02,13:25,931691043,Sinalizador Diant e Tras Jws JY009 Bike Silicone Luz Noturna 2 Leds Branco e Vermelho 7131,17.0,São José dos Campos,Centro,12245680,https://sp.olx.com.br/vale-do-paraiba-e-litoral-norte/ciclismo/sinalizador-diant-e-tras-jws-jy009-bike-silicone-luz-noturna-2-leds-branco-e-vermelho-7131-931691043
86,14/02,13:13,945762338,Pedal de encaixe Clip Mountain-Bike Vicini MT530 Preto Com Taquinhos tipo Shiman (9106),180.0,São José dos Campos,Centro,12245680,https://sp.olx.com.br/vale-do-paraiba-e-litoral-norte/ciclismo/pedal-de-encaixe-clip-mountain-bike-vicini-mt530-preto-com-taquinhos-tipo-shiman-9106-945762338
87,14/02,13:13,923521572,Lanterna Farol Dianteiro para Bike Jws JY-263 Super Led Preto Recarregável 5377,72.0,São José dos Campos,Centro,12245680,https://sp.olx.com.br/vale-do-paraiba-e-litoral-norte/ciclismo/lanterna-farol-dianteiro-para-bike-jws-jy-263-super-led-preto-recarregavel-5377-923521572
88,14/02,13:13,1039262172,Abraçadeira Para Passadores de Marchas Sram Trigger Shifter XX1 X01 X0 X9 X7 Eagle 5665,24.0,São José dos Campos,Vila Ester,12221680,https://sp.olx.com.br/vale-do-paraiba-e-litoral-norte/ciclismo/abracadeira-para-passadores-de-marchas-sram-trigger-shifter-xx1-x01-x0-x9-x7-eagle-5665-1039262172
89,,,,,,,,,
90,14/02,11:37,1037356762,Guia de Cabo de Câmbio Para Quadro de Bicicleta Speed/MTB Fixação Movimento Central 8613,3.0,São José dos Campos,Vila Ester,12221680,https://sp.olx.com.br/vale-do-paraiba-e-litoral-norte/ciclismo/guia-de-cabo-de-cambio-para-quadro-de-bicicleta-speed-mtb-fixacao-movimento-central-8613-1037356762
91,14/02,11:37,1037281317,Sinalizador Led Jws WS-206 Recarregável USB 5 Leds Pisca Vermelho 4 Modos Super Forte 8633,15.0,São José dos Campos,Vila Ester,12221680,https://sp.olx.com.br/vale-do-paraiba-e-litoral-norte/ciclismo/sinalizador-led-jws-ws-206-recarregavel-usb-5-leds-pisca-vermelho-4-modos-super-forte-8633-1037281317
92,14/02,11:37,909433819,Ferramenta de Reparo Macarrão Para Pneu Tubeless para Bike com Agulha ArStop 3776,52.0,São José dos Campos,Centro,12245680,https://sp.olx.com.br/vale-do-paraiba-e-litoral-norte/ciclismo/ferramenta-de-reparo-macarrao-para-pneu-tubeless-para-bike-com-agulha-arstop-3776-909433819
93,14/02,11:37,914853771,Chave Jws Instalação Movimento Central Hollowtech Shimano Truvativ Fsa Megaexo 7363,23.0,São José dos Campos,Centro,12245680,https://sp.olx.com.br/vale-do-paraiba-e-litoral-norte/ciclismo/chave-jws-instalacao-movimento-central-hollowtech-shimano-truvativ-fsa-megaexo-7363-914853771
94,14/02,11:15,1147032139,Bike MTB 29 VZAN,3000.0,São Paulo,Cambuci,01543000,https://sp.olx.com.br/sao-paulo-e-regiao/ciclismo/bike-mtb-29-vzan-1147032139
95,14/02,11:05,935306727,GPS Ciclocomputador para Bikes Absolute Nero Compatível com Strava 7229,180.0,São José dos Campos,Centro,12245680,https://sp.olx.com.br/vale-do-paraiba-e-litoral-norte/ciclismo/gps-ciclocomputador-para-bikes-absolute-nero-compativel-com-strava-7229-935306727
96,,,,,,,,,
97,14/02,11:04,930648229,Sinalizador Diant Traseiro Vortex Bike Silicone Luz Noturna 2 Leds Branco e Vermelho 7077,21.0,São José dos Campos,Centro,12245680,https://sp.olx.com.br/vale-do-paraiba-e-litoral-norte/ciclismo/sinalizador-diant-traseiro-vortex-bike-silicone-luz-noturna-2-leds-branco-e-vermelho-7077-930648229
98,14/02,11:04,1028440067,Bolsa de Banco Selim para Bicicleta Marca B-Soul Para Ferramentas e Acessórios 9021,36.0,São José dos Campos,Centro,12245680,https://sp.olx.com.br/vale-do-paraiba-e-litoral-norte/ciclismo/bolsa-de-banco-selim-para-bicicleta-marca-b-soul-para-ferramentas-e-acessorios-9021-1028440067
99,14/02,11:03,1028116814, Pedivela Triplo Bicicleta Mtb Absolute 170mm Preto 170 42/34/24 Dentes (9080),54.0,São José dos Campos,Centro,12245680,https://sp.olx.com.br/vale-do-paraiba-e-litoral-norte/ciclismo/pedivela-triplo-bicicleta-mtb-absolute-170mm-preto-170-42-34-24-dentes-9080-1028116814
100,14/02,10:52,1029032559,Rodinha Lateral para Bicicleta Infantil Aro 20 Roda de Equilíbrio 8900,23.0,São José dos Campos,Vila Ester,12221680,https://sp.olx.com.br/vale-do-paraiba-e-litoral-norte/ciclismo/rodinha-lateral-para-bicicleta-infantil-aro-20-roda-de-equilibrio-8900-1029032559
101,14/02,10:52,1032023650,"Bolsa Porta Celular Para Guidão de Bicicleta B-Soul com Visor até 6,4 polegadas 9011",50.0,São José dos Campos,Vila Ester,12221680,https://sp.olx.com.br/vale-do-paraiba-e-litoral-norte/ciclismo/bolsa-porta-celular-para-guidao-de-bicicleta-b-soul-com-visor-ate-6-4-polegadas-9011-1032023650
102,14/02,10:50,1030861783,Sinalizador Led 70 Lumens Jws WS-096 Recarregável USB Led Vermelho/Branco 6 Modos 7127,49.0,São José dos Campos,Vila Ester,12221680,https://sp.olx.com.br/vale-do-paraiba-e-litoral-norte/ciclismo/sinalizador-led-70-lumens-jws-ws-096-recarregavel-usb-led-vermelho-branco-6-modos-7127-1030861783
103,14/02,10:50,926390052,Sinalizador Diant e Tras Absolute JY-267 para Bike Silicone c 2 Leds Branco Vermelho 6985,23.0,São José dos Campos,Centro,12245680,https://sp.olx.com.br/vale-do-paraiba-e-litoral-norte/ciclismo/sinalizador-diant-e-tras-absolute-jy-267-para-bike-silicone-c-2-leds-branco-vermelho-6985-926390052
104,14/02,10:41,950051207,Garupa Bagageiro Traseiro Bicicleta Kalf Serve em Aro 26-29 Flex Reforçado 9113,90.0,São José dos Campos,Centro,12245680,https://sp.olx.com.br/vale-do-paraiba-e-litoral-norte/ciclismo/garupa-bagageiro-traseiro-bicicleta-kalf-serve-em-aro-26-29-flex-reforcado-9113-950051207
105,14/02,10:41,926858217,Sinalizador com Led Jws Ws-207 Recarregável usb 7 Leds Vermelho Amarelo 4 Modos 7133,26.0,São José dos Campos,Centro,12245680,https://sp.olx.com.br/vale-do-paraiba-e-litoral-norte/ciclismo/sinalizador-com-led-jws-ws-207-recarregavel-usb-7-leds-vermelho-amarelo-4-modos-7133-926858217
106,14/02,10:39,923954794,Roda Livre Catraca Pinhão 18 Dentes p/ Cubo Traseiro Rosca Corrente Grossa 9203,13.0,São José dos Campos,Centro,12245680,https://sp.olx.com.br/vale-do-paraiba-e-litoral-norte/ciclismo/roda-livre-catraca-pinhao-18-dentes-p-cubo-traseiro-rosca-corrente-grossa-9203-923954794
107,13/02,22:28,1083145521,Bicicleta MTB Sense One 21v 2021/2022 - Nova na caixa,2290.0,São Paulo,Indianópolis,04062003,https://sp.olx.com.br/sao-paulo-e-regiao/ciclismo/bicicleta-mtb-sense-one-21v-2021-2022-nova-na-caixa-1083145521
108,13/02,21:18,1083778543,Bicicleta Urbana Feminina Groove Cosmopolitan Easy Step 7v 2021 - Nova na caixa,2199.0,São Paulo,Indianópolis,04062003,https://sp.olx.com.br/sao-paulo-e-regiao/ciclismo/bicicleta-urbana-feminina-groove-cosmopolitan-easy-step-7v-2021-nova-na-caixa-1083778543
109,13/02,10:59,1146568551,Caloi 10 1983,1100.0,Santos,Embaré,11040240,https://sp.olx.com.br/baixada-santista-e-litoral-sul/ciclismo/caloi-10-1983-1146568551
110,13/02,08:56,1146509875,Rolo de treinamento Absolulte Wild 5,320.0,São Paulo,Santo Amaro,04743030,https://sp.olx.com.br/sao-paulo-e-regiao/ciclismo/rolo-de-treinamento-absolulte-wild-5-1146509875
111,13/02,08:55,1146509467,Caloi Peri 1979,800.0,Santos,Embaré,11040240,https://sp.olx.com.br/baixada-santista-e-litoral-sul/ciclismo/caloi-peri-1979-1146509467
