,diaPostagem,hora,codigo,nomeBike,precoBike,cidade,bairro,cep,urlBike
0,25 fev,12:11,999650239.0,Moto Sccoter Beach 8S - Elétrica - 2022 Com SOM,15200.0,São Vicente, Jardim Independência - DDD 13,11380000.0,https://sp.olx.com.br/baixada-santista-e-litoral-sul/ciclismo/moto-sccoter-beach-8s-eletrica-2022-com-som-999650239
1,17 fev,22:31,986167694.0,Relogio Digital SmartWatch Full Touch P80 [Preto],190.0,São José dos Campos, Jardim Satélite - DDD 12,12230730.0,https://sp.olx.com.br/vale-do-paraiba-e-litoral-norte/ciclismo/relogio-digital-smartwatch-full-touch-p80-preto-986167694
2,07 Mar,21:31,996256313.0,Caixa de direção over 1.1/8,60.0,Taquaritinga - DDD 16, ,15900000.0,https://sp.olx.com.br/regiao-de-ribeirao-preto/ciclismo/caixa-de-direcao-over-1-1-8-996256313
3,07 Mar,18:27,934361669.0,SPEED(52) SCOTT SPEEDSTER SORA9v (12x498). Troco\Envio\*Entrego,5200.0,Americana, Jardim São Vito - DDD 19,13473220.0,https://sp.olx.com.br/grande-campinas/ciclismo/speed-52-scott-speedster-sora9v-12x498-troco-envio-entrego-934361669
4,07 Mar,18:24,974067138.0,"SPEED 52 KUOTA CARBON, SHIMANO105 11v (No Cartão 18x632). Troco\Envio\*Entrego",9900.0,Americana, Jardim São Vito - DDD 19,13473220.0,https://sp.olx.com.br/grande-campinas/ciclismo/speed-52-kuota-carbon-shimano105-11v-no-cartao-18x632-troco-envio-entrego-974067138
5,07 Mar,18:23,922120452.0,"SPEED(55) CALOI STRADA, SHIMANO SORA 8v, (Cartão 12x328). Aceito troca. *Entrego",2999.0,Americana, Jardim São Vito - DDD 19,13473220.0,https://sp.olx.com.br/grande-campinas/ciclismo/speed-55-caloi-strada-shimano-sora-8v-cartao-12x328-aceito-troca-entrego-922120452
6,07 Mar,15:06,1002992073.0,BMX FREESTYLE SERIE 8 toda original perfeito funcionamento,600.0,Sorocaba, Jardim Santo André - DDD 15,18077332.0,https://sp.olx.com.br/regiao-de-sorocaba/ciclismo/bmx-freestyle-serie-8-toda-original-perfeito-funcionamento-1002992073
7,07 Mar,14:31,1001180062.0,Corrente Bicicleta Sram X1 11v 118 Links Com Powerlink Mtb,345.0,São Paulo, Planalto Paulista - DDD 11,4077003.0,https://sp.olx.com.br/sao-paulo-e-regiao/ciclismo/corrente-bicicleta-sram-x1-11v-118-links-com-powerlink-mtb-1001180062
8,07 Mar,13:31,997173293.0,Bicicleta Sense Fun Evo 2021/22 Mtb Aro 29 Alívio 18v Aqua,3700.0,Votorantim, Parque Jataí - DDD 15,18117250.0,https://sp.olx.com.br/regiao-de-sorocaba/ciclismo/bicicleta-sense-fun-evo-2021-22-mtb-aro-29-alivio-18v-aqua-997173293
9,07 Mar,12:34,979993453.0,Bicicleta Oggi 8.3 Big Whell E-Bike Shimano Deore - L,18279.0,São Paulo, Centro - DDD 11,1034030.0,https://sp.olx.com.br/sao-paulo-e-regiao/ciclismo/bicicleta-oggi-8-3-big-whell-e-bike-shimano-deore-l-979993453
10,06 Mar,22:31,1001826435.0,Bike aro 24 18 marchas ,450.0,Bauru, Núcleo Habitacional Nobuji Nagasawa - DDD 14,17026831.0,https://sp.olx.com.br/regiao-de-bauru-e-marilia/ciclismo/bike-aro-24-18-marchas-1001826435
11,06 Mar,21:31,994920695.0,Coroa Narrow Wide Single Bcd 104 Absolute Prime 7075,90.0,Botucatu, Jardim Itamarati - DDD 14,18608007.0,https://sp.olx.com.br/regiao-de-bauru-e-marilia/ciclismo/coroa-narrow-wide-single-bcd-104-absolute-prime-7075-994920695
12,06 Mar,19:31,988588424.0,Bicicleta MTB Sense Fun Evo 18v 2021/2022,4490.0,São Paulo, Indianópolis - DDD 11,4062003.0,https://sp.olx.com.br/sao-paulo-e-regiao/ciclismo/bicicleta-mtb-sense-fun-evo-18v-2021-2022-988588424
13,06 Mar,19:31,963839606.0,Bicicleta MTB Groove SKA 30.1 HD 18v 2021,4599.0,São Paulo, Indianópolis - DDD 11,4062003.0,https://sp.olx.com.br/sao-paulo-e-regiao/ciclismo/bicicleta-mtb-groove-ska-30-1-hd-18v-2021-963839606
14,06 Mar,16:40,1002735629.0,Sense impact pro 18v,4500.0,Lorena - DDD 12, ,12600000.0,https://sp.olx.com.br/vale-do-paraiba-e-litoral-norte/ciclismo/sense-impact-pro-18v-1002735629
15,06 Mar,16:31,995016700.0,Igpsport 618 Ciclocomputador GPS,600.0,São José dos Campos, Parque Residencial Aquarius - DDD 12,12246024.0,https://sp.olx.com.br/vale-do-paraiba-e-litoral-norte/ciclismo/igpsport-618-ciclocomputador-gps-995016700
16,07 Mar,20:01,1000128632.0,Bike fixa,800.0,São Paulo, Jardim Alvorada (Zona Oeste) - DDD 11,5528120.0,https://sp.olx.com.br/sao-paulo-e-regiao/ciclismo/bike-fixa-1000128632
17,07 Mar,16:01,997156221.0,"Rolo de Treino Absolute, Speed Mtb Fixa p/ 26 27,5 29 - NOVO",450.0,São Paulo, Sé - DDD 11,1003000.0,https://sp.olx.com.br/sao-paulo-e-regiao/ciclismo/rolo-de-treino-absolute-speed-mtb-fixa-p-26-27-5-29-novo-997156221
18,07 Mar,15:17,1002996468.0,Bike Fixa/Single 52,2200.0,Campinas, Jardim Flamboyant - DDD 19,13091140.0,https://sp.olx.com.br/grande-campinas/ciclismo/bike-fixa-single-52-1002996468
19,2 mar,14:40,1001218022.0,Bike Fixa 56,1200.0,Piracicaba, Cidade Alta - DDD 19,13419000.0,https://sp.olx.com.br/grande-campinas/ciclismo/bike-fixa-56-1001218022
20,23 fev,20:24,998886200.0,Bike aro 29 TsW stamina 2021 18v kit shimano alívio,4148.0,São Paulo, Jardim Líbano - DDD 11,5138200.0,https://sp.olx.com.br/sao-paulo-e-regiao/ciclismo/bike-aro-29-tsw-stamina-2021-18v-kit-shimano-alivio-998886200
21,20 fev,17:31,987312376.0,BIKE FIXA KHS FLITE 100 TAM. 49,1899.0,São Paulo, Aclimação - DDD 11,4108130.0,https://sp.olx.com.br/sao-paulo-e-regiao/ciclismo/bike-fixa-khs-flite-100-tam-49-987312376
22,18 fev,16:31,987573624.0,Manopla Punho Bike Espuma Gel Silicone MTB Fixa ,18.0,São Paulo, Bela Vista - DDD 11,1315001.0,https://sp.olx.com.br/sao-paulo-e-regiao/ciclismo/manopla-punho-bike-espuma-gel-silicone-mtb-fixa-987573624
23,17 fev,17:14,995971681.0,Manete para bike fixa em aluminio 22.2 mm novo,99.0,São Paulo, Vila Rui Barbosa - DDD 11,3733100.0,https://sp.olx.com.br/sao-paulo-e-regiao/ciclismo/manete-para-bike-fixa-em-aluminio-22-2-mm-novo-995971681
24,11 fev,15:02,993033645.0,Bike Fixa,1300.0,São José dos Campos, Parque dos Ipês - DDD 12,12236865.0,https://sp.olx.com.br/vale-do-paraiba-e-litoral-norte/ciclismo/bike-fixa-993033645
25,06 Mar,20:31,921212986.0,Bicicleta Urbana Groove Cosmopolitan 7v 2021,2099.0,São Paulo, Indianópolis - DDD 11,4062003.0,https://sp.olx.com.br/sao-paulo-e-regiao/ciclismo/bicicleta-urbana-groove-cosmopolitan-7v-2021-921212986
26,06 Mar,20:31,977650578.0,Bicicleta MTB Caloi Explorer Comp 18v 2021,4299.0,São Paulo, Indianópolis - DDD 11,4062003.0,https://sp.olx.com.br/sao-paulo-e-regiao/ciclismo/bicicleta-mtb-caloi-explorer-comp-18v-2021-977650578
27,06 Mar,19:31,940931396.0,Bicicleta Urbana Groove Blues MD 21v 2021,2999.0,São Paulo, Indianópolis - DDD 11,4062003.0,https://sp.olx.com.br/sao-paulo-e-regiao/ciclismo/bicicleta-urbana-groove-blues-md-21v-2021-940931396
28,06 Mar,19:31,979526785.0,Bicicleta Urbana Groove Urban ID 21v 2021,2999.0,São Paulo, Indianópolis - DDD 11,4062003.0,https://sp.olx.com.br/sao-paulo-e-regiao/ciclismo/bicicleta-urbana-groove-urban-id-21v-2021-979526785
29,06 Mar,14:31,921212537.0,Bicicleta Urbana Feminina Groove Cosmopolitan Easy Step 7v 2021,2099.0,São Paulo, Indianópolis - DDD 11,4062003.0,https://sp.olx.com.br/sao-paulo-e-regiao/ciclismo/bicicleta-urbana-feminina-groove-cosmopolitan-easy-step-7v-2021-921212537
30,4 mar,19:31,994294718.0,Troco Troca Dobrável Soul por CALOI 10 FIXA,999.0,São José dos Campos, Jardim São Dimas - DDD 12,12245021.0,https://sp.olx.com.br/vale-do-paraiba-e-litoral-norte/ciclismo/troco-troca-dobravel-soul-por-caloi-10-fixa-994294718
31,3 mar,22:12,1001915029.0,Bicicleta Fixa Raf Bikes Simplicity,1600.0,Pradópolis - DDD 16, ,14850000.0,https://sp.olx.com.br/regiao-de-ribeirao-preto/ciclismo/bicicleta-fixa-raf-bikes-simplicity-1001915029
32,3 mar,22:01,912096978.0,Bicicleta MTB Audax Havok NX 18v 2021,3799.0,São Paulo, Indianópolis - DDD 11,4062003.0,https://sp.olx.com.br/sao-paulo-e-regiao/ciclismo/bicicleta-mtb-audax-havok-nx-18v-2021-912096978
33,2 mar,23:12,1001418115.0,Bicicleta Vintage Fixa,1200.0,Ribeirão Preto, Parque das Andorinhas - DDD 16,14057040.0,https://sp.olx.com.br/regiao-de-ribeirao-preto/ciclismo/bicicleta-vintage-fixa-1001418115
34,2 mar,20:06,1001361447.0,Bicicleta 29 7.0 Oggi Big Wheel 18v ,3799.0,São Paulo, Jardim Santo Elias - DDD 11,5110000.0,https://sp.olx.com.br/sao-paulo-e-regiao/ciclismo/bicicleta-29-7-0-oggi-big-wheel-18v-1001361447
35,1 mar,14:01,991584961.0,"Bicicleta Gt Agressor Aro 26 Deore Xt - Tam 18,5 - Muito Nova",2650.0,Araraquara, Centro - DDD 16,14801130.0,https://sp.olx.com.br/regiao-de-ribeirao-preto/ciclismo/bicicleta-gt-agressor-aro-26-deore-xt-tam-18-5-muito-nova-991584961
36,1 mar,12:06,1000789043.0,Bicicleta Elétrica Urbana Caloi E-Vibe Urbam 2021,8199.0,São Paulo, Indianópolis - DDD 11,4062003.0,https://sp.olx.com.br/sao-paulo-e-regiao/ciclismo/bicicleta-eletrica-urbana-caloi-e-vibe-urbam-2021-1000789043
37,28 fev,17:39,1000581518.0,"Bicicleta fixa aro 27"" cubo flip-flop",850.0,Nova Odessa, Jardim Santa Rita I - DDD 19,13386068.0,https://sp.olx.com.br/grande-campinas/ciclismo/bicicleta-fixa-aro-27-cubo-flip-flop-1000581518
38,27 fev,21:31,990582769.0,Jogo Direção C/trava Bicicleta Fixa Monark Caloi 10 ,50.0,Santo André, Parque João Ramalho - DDD 11,9290210.0,https://sp.olx.com.br/sao-paulo-e-regiao/ciclismo/jogo-direcao-c-trava-bicicleta-fixa-monark-caloi-10-990582769
39,27 fev,16:26,1000295513.0,Vendo bicicleta fixa ,800.0,Guarujá, Sítio Paecara (Vicente de Carvalho) - DDD 13,11460101.0,https://sp.olx.com.br/baixada-santista-e-litoral-sul/ciclismo/vendo-bicicleta-fixa-1000295513
40,25 fev,10:50,999610249.0,Bicicleta Fixa ,1300.0,Campinas, Chácara Santa Margarida - DDD 19,13085415.0,https://sp.olx.com.br/grande-campinas/ciclismo/bicicleta-fixa-999610249
41,23 fev,14:52,926390052.0,Sinalizador Diant e Tras Absolute JY-267 para Bike Silicone c 2 Leds Branco Vermelho 6985,23.0,São José dos Campos, Centro - DDD 12,12245680.0,https://sp.olx.com.br/vale-do-paraiba-e-litoral-norte/ciclismo/sinalizador-diant-e-tras-absolute-jy-267-para-bike-silicone-c-2-leds-branco-vermelho-6985-926390052
42,23 fev,13:46,998684924.0,Bicicleta motorizada 80cc,2000.0,São Paulo, Parque Guarani - DDD 11,8235000.0,https://sp.olx.com.br/sao-paulo-e-regiao/ciclismo/bicicleta-motorizada-80cc-998684924
43,22 fev,14:56,998102653.0,Bicicleta Fixa Airwalk ,1000.0,Marília, Jardim Maria Izabel - DDD 14,17516230.0,https://sp.olx.com.br/regiao-de-bauru-e-marilia/ciclismo/bicicleta-fixa-airwalk-998102653
44,18 fev,10:46,996207404.0,"Suporte de Celular Bike e Moto Fixo no Guidão com Touchscreen Prova D'agua até 6,5"" 8355",27.0,São José dos Campos, Centro - DDD 12,12245680.0,https://sp.olx.com.br/vale-do-paraiba-e-litoral-norte/ciclismo/suporte-de-celular-bike-e-moto-fixo-no-guidao-com-touchscreen-prova-d-agua-ate-6-5-8355-996207404
45,17 fev,16:04,939717699.0,Suporte de Celular para Bike JWS e Sinalizador Epic Line Dianteiro e Traseiro Led 7845,43.0,São José dos Campos, Centro - DDD 12,12245680.0,https://sp.olx.com.br/vale-do-paraiba-e-litoral-norte/ciclismo/suporte-de-celular-para-bike-jws-e-sinalizador-epic-line-dianteiro-e-traseiro-led-7845-939717699
46,17 fev,15:55,938805621.0,Lanterna WS-205 800 Lúmens e Sinalizador Led WS-207 Vermelho Amarelo Recarregável 7605,87.0,São José dos Campos, Centro - DDD 12,12245680.0,https://sp.olx.com.br/vale-do-paraiba-e-litoral-norte/ciclismo/lanterna-ws-205-800-lumens-e-sinalizador-led-ws-207-vermelho-amarelo-recarregavel-7605-938805621
47,17 fev,15:43,946252516.0,Kit Lanterna Dianteira Bike WS-205 e Sinalizador Traseiro JY-918 JWS Recarregável 7607,59.0,São José dos Campos, Centro - DDD 12,12245680.0,https://sp.olx.com.br/vale-do-paraiba-e-litoral-norte/ciclismo/kit-lanterna-dianteira-bike-ws-205-e-sinalizador-traseiro-jy-918-jws-recarregavel-7607-946252516
48,17 fev,15:37,995923449.0,Kit de Manutenção Basica para Relação Transmissão Bike com Pedivela Eixo Integrado 8445kit,51.0,São José dos Campos, Centro - DDD 12,12245680.0,https://sp.olx.com.br/vale-do-paraiba-e-litoral-norte/ciclismo/kit-de-manutencao-basica-para-relacao-transmissao-bike-com-pedivela-eixo-integrado-8445kit-995923449
49,17 fev,14:55,995904125.0,Bicicleta Speed Single Speed/Fixa KHS Urban Soul Importada USA,3200.0,São Paulo, Ipiranga - DDD 11,4208001.0,https://sp.olx.com.br/sao-paulo-e-regiao/ciclismo/bicicleta-speed-single-speed-fixa-khs-urban-soul-importada-usa-995904125
50,17 fev,14:19,995892437.0,Suporte de Celular Veicular Carro Articulado com Ventosa para Painel ou Vidro 8365,20.0,São José dos Campos, Centro - DDD 12,12245680.0,https://sp.olx.com.br/vale-do-paraiba-e-litoral-norte/ciclismo/suporte-de-celular-veicular-carro-articulado-com-ventosa-para-painel-ou-vidro-8365-995892437
51,17 fev,07:10,995685713.0,Bicicleta TsW 29 Stamina grupo alívio 18v NoVa NF,4150.0,São Paulo, Jardim Santo Elias - DDD 11,5110000.0,https://sp.olx.com.br/sao-paulo-e-regiao/ciclismo/bicicleta-tsw-29-stamina-grupo-alivio-18v-nova-nf-995685713
52,16 fev,10:20,995198909.0,Bicicleta fixa Giant tamanho 53,1400.0,São Paulo, Vila Santana - DDD 11,3613100.0,https://sp.olx.com.br/sao-paulo-e-regiao/ciclismo/bicicleta-fixa-giant-tamanho-53-995198909
53,16 fev,10:07,995189794.0,Bicicleta Gallo aro 26 caloi fixa speed single  Specialized pegeout  aro 29,700.0,São Paulo, Jardim Santo Elias - DDD 11,5136160.0,https://sp.olx.com.br/sao-paulo-e-regiao/ciclismo/bicicleta-gallo-aro-26-caloi-fixa-speed-single-specialized-pegeout-aro-29-995189794
54,16 fev,09:58,995180415.0,Peugeot Fixa,1000.0,Santos, Embaré - DDD 13,11040240.0,https://sp.olx.com.br/baixada-santista-e-litoral-sul/ciclismo/peugeot-fixa-995180415
55,15 fev,16:10,994824199.0,Caloi 10 1981,850.0,Santos, Aparecida - DDD 13,11025250.0,https://sp.olx.com.br/baixada-santista-e-litoral-sul/ciclismo/caloi-10-1981-994824199
56,14 fev,16:15,945752121.0,Kit Lanterna Dianteira Bike WS-205 e Sinalizador Traseiro JY-918 JWS Recarregável 7607kit,80.0,São José dos Campos, Centro - DDD 12,12245680.0,https://sp.olx.com.br/vale-do-paraiba-e-litoral-norte/ciclismo/kit-lanterna-dianteira-bike-ws-205-e-sinalizador-traseiro-jy-918-jws-recarregavel-7607kit-945752121
57,14 fev,16:14,946254372.0,Kit Ciclocomputador WS-581 15 funções Sinalizador Dian e Tras JY009 JWS Led,57.0,São José dos Campos, Centro - DDD 12,12245680.0,https://sp.olx.com.br/vale-do-paraiba-e-litoral-norte/ciclismo/kit-ciclocomputador-ws-581-15-funcoes-sinalizador-dian-e-tras-jy009-jws-led-946254372
58,11 fev,14:55,935769856.0,Sinalizador Epic Line XC-782 Diant e Tras Silicone com Led Luz Noturna de Segurança 7511,9.0,São José dos Campos, Centro - DDD 12,12245680.0,https://sp.olx.com.br/vale-do-paraiba-e-litoral-norte/ciclismo/sinalizador-epic-line-xc-782-diant-e-tras-silicone-com-led-luz-noturna-de-seguranca-7511-935769856
59,11 fev,14:53,935252961.0,Kit Chave Movimento Central Hollowtech com Ferramenta Extrator de Coroa Shimano 8049,113.0,São José dos Campos, Centro - DDD 12,12245680.0,https://sp.olx.com.br/vale-do-paraiba-e-litoral-norte/ciclismo/kit-chave-movimento-central-hollowtech-com-ferramenta-extrator-de-coroa-shimano-8049-935252961
60,23 fev,20:31,976648722.0,Suporte de Fixação Thule Rapid System (757) + Barras,880.0,São José dos Campos, Urbanova III - DDD 12,12244525.0,https://sp.olx.com.br/vale-do-paraiba-e-litoral-norte/ciclismo/suporte-de-fixacao-thule-rapid-system-757-barras-976648722
61,18 fev,10:19,996197099.0,Bolsa Para Bicicleta Alforge Deuter Rack Pack Uni 38l,450.0,São Paulo, Cidade São Francisco - DDD 11,5351025.0,https://sp.olx.com.br/sao-paulo-e-regiao/ciclismo/bolsa-para-bicicleta-alforge-deuter-rack-pack-uni-38l-996197099
62,14 fev,21:10,994347786.0,Peças para bicicleta Fixa speed,15.0,São Paulo, Vila União (Zona Leste) - DDD 11,3683000.0,https://sp.olx.com.br/sao-paulo-e-regiao/ciclismo/pecas-para-bicicleta-fixa-speed-994347786
63,26 fev,23:23,1000161704.0,Bicicleta dobrável Night Riders Caixa,1500.0,Itu, Jardim dos Ipês - DDD 11,13309868.0,https://sp.olx.com.br/sao-paulo-e-regiao/ciclismo/bicicleta-dobravel-night-riders-caixa-1000161704
64,24 fev,16:56,999340338.0,Bicicleta Night Riders,700.0,Embu das Artes, Jardim Independência - DDD 11,6826100.0,https://sp.olx.com.br/sao-paulo-e-regiao/ciclismo/bicicleta-night-riders-999340338
65,15 fev,02:51,994459619.0,Bicicleta Fixa da Caixa (Caixinha) Single Speed Aro 700 Toda Original Bike Bem Conservada,1200.0,São Paulo, Vila Fachini - DDD 11,4326100.0,https://sp.olx.com.br/sao-paulo-e-regiao/ciclismo/bicicleta-fixa-da-caixa-caixinha-single-speed-aro-700-toda-original-bike-bem-conservada-994459619
